commenterID,UserName,Date,Text
UCcXFaZNSKplZHwonTl4B-7A,@nievestas,2023-03-20T23:36:52Z,DESHALB BRAUCHT MAN EINE DEUTSCHE TRUMP VERWANDTE DIE MAN MIT MK ULTRA ZU TODE FOLTERT FÜR HOLOCAUST II UM DIE GEIMPFTEN MIT FÜR COVID NESARA ZUM ENERGIESPENDER FÜRS ELECTRIC UNIVERSE ZU MACHEN DAMIT DER BLOCKCHAIN GESTÜTZT IST SONST SIND ALLE PLEITE WENN DER STROM AUSFÄLLT!
UC2bMXH2A1Kh03OPxA9WaU-w,@natuerlicheshalbwissen,2023-03-20T22:36:36Z,"Wenn das Finanzsystem eh zusammen bricht, was interessiert einen Geld dann noch? Dann wird man sehen, was wirklich wichtig ist"
UCJspnfLKHUinZjp6azmKWRA,@blockhaus8269,2023-03-20T21:36:19Z,"Die Raiffeisenbanken in der Schweiz sind seriöse,haben viele Liegenschaften wo sie Hypotheken platziert haben,eben nur in der Schweiz,darum geht es diesen Raiffeisenbanken gut 😊"
UCJspnfLKHUinZjp6azmKWRA,@blockhaus8269,2023-03-20T21:29:09Z,"Darum ist es gut wenn eine Bank viel Hypotheken vergibt,diese Kunden bezahlen den Zins ein und springen nicht ab,die Hochstapler sollten gut überlegen,ob sie Geschäfte im Ausland vermehrt abwickeln sollten,ich sage Nein,Inland Geschäfte abwickeln,weniger ist mehr."
UCZw5gbBkKBzDjPvHthc50ew,@xTheBlackLpx,2023-03-20T21:10:32Z,"<a href=""https://www.youtube.com/watch?v=WV-E7VAQNi4&amp;t=252"">4:12</a> da ist wohl der zentral bank das geld ausgegangen 🤣"
UC_gAPA91jOWqAzZHpetX2Og,@projectbimmerz9698,2023-03-20T20:24:21Z,😂 extrem unterhaltsam vorgestellt Marc 👍🏻<br><br>Auch wenns eigentlich nichts zu lachen gibt … leider 🙈
UCZMOT9oySRLXEJ3KrwW2loA,@toby_3607,2023-03-20T20:21:54Z,Der war gut mit den Money Gun 😂 weiter so.
UCqgSoRoO3uBiMObxGyniqmw,@adrianabel6412,2023-03-20T20:15:37Z,"Wegen Alf, hab ich richtig gehört :) bester Kerl,"
UCc9C0EqwlAZjKc1sGbiXF3w,@jl6031,2023-03-20T18:02:54Z,😂😂😂😂
UC-1S2fvV2Wpau8iz6ffYHcw,@mikeluczakowski4074,2023-03-20T17:41:05Z,"Oh danke Marc,für diesen   Information Müll,Oh danke Marc das du uns in.             20 Minuten das Weltweite  bescheuerte Bankensysthem wieder einmal erklärt hast.Bis auf deine Empfehlungen klar.   Top viedeo nichts <br>verstanden aber gut <br>erzählt.Sag mal Leute geht&#39;s noch Akrich!!😢"
UC-1S2fvV2Wpau8iz6ffYHcw,@mikeluczakowski4074,2023-03-20T17:28:13Z,"Bei den Kommentaren von  Marc Friedrich fällt mir auf,daß er am Anfang           immer erzählt,wie widerlich,korupt und verkommen doch das ganze Bankensystem ist.     Zum Schluss aber gibt es   dan,seine Top Anlageberatung plus           Buchtipp ja ja alles wieder in Ordnung!!😊😊😊"
UCwXXnFKLNYdPMaiiZF_FB5w,@herbertthiebet211,2023-03-20T17:21:04Z,ICH ♥️ Lösungen und Möglichkeiten in DEZENTRALEN Strukturen und Systemen.  💯🤙😎
UC-1S2fvV2Wpau8iz6ffYHcw,@mikeluczakowski4074,2023-03-20T17:20:25Z,Auf diesem Kanal wird sowieso alles kritisch gelöscht!!!!
UCK6x-9woZA72p7FscLabZyw,@mariamuller489,2023-03-20T17:03:58Z,… vorallem wegen ALF 😂
UCjnsjJJ_XeENJv07tuVhG4g,@realtalktv-andismeinung5213,2023-03-20T16:58:04Z,Immer wenn ich höre: ist dein Erspartes noch sicher?&quot; Denke ich mir: welches Erspartes? 😅
UCDToXTB7itRR3V-z8NoelCw,@jurgensonnenhut2310,2023-03-20T16:57:37Z,Warum sagt die Bank einfach nicht &quot;Ich kann mich nicht mehr dran erinnern &quot; und alles ist gut 🤓
UCqBAu3f6uCwENXC9mwIPTNg,@SuperGau420,2023-03-20T16:50:02Z,"Keine Sorgen, alles Systemrelvanten Banken werden gerettet"
UCSDWBA7xYcnJwV9ndqxzCzA,@juanfloreslorente5427,2023-03-20T16:48:38Z,Excelsior 🤣👍<br>Nicht mal in Horriwood könnte man so ein Drehbuch schreiben können..🤣
UCFYYUTuQgk9dXAjRLT5Lg6g,@Chris-hz8ll,2023-03-20T16:42:44Z,"Bitcoin mag zwar nicht beliebig vermehrbar sein, aber die Bitcoin sind noch ungerechter verteilt als das FIAT-Geld. Ne, Bitcoin ist da auch keine Lösung."
UCIecS25TrrEevEJcMefUV-Q,@maria-sabinedose8360,2023-03-20T16:30:58Z,"Hallo lieber Marc, hab herzlich Dank für deine klaren rasanten Ausführungen über unser aller Krankes korruptes und zerstörerisches Geldsystem. Alle Daumen hoch und ich läute die Glocke, damit du deinen Power und Lust nicht verlierst, uns die krisengeschüttelten  Menschen weiter über die News zu informieren?<br>Es macht fast schon wieder gute Laune deinen Videos zu folgen! Ein Bedenken zum Thema Bitcoin hab ich dennoch. Was tun bei Stromausfall? <br><br>Alles Liebe dir , bleib Gesund und Munter. 🍀👍😄🙏🤗👍 M."
UCGzbGWa2GS0U57YccQW8h5Q,@ronaldp.8051,2023-03-20T15:55:01Z,"Die Welt ist ein Organismus, der von mehreren Parasiten befallen ist, die sie steuern, den Banken und ihren Helfern. Und wenn Politiker und die Medien in deren Arschritze euch was von wegen »Euer Geld ist total sicher« erzählen, dann könnt ihr getrost vom Gegenteil ausgehen."
UCepNTddEahePhymPdPXUnsQ,@Gaara21211,2023-03-20T15:48:53Z,"Mit der Schweiz geht es leider stetig bachab. Nicht nur die Neutralität ist von unseren Linken und Grünen wie auch Mitte Parteien wie Fdp zerbeult. Gelder werden zwangsbeschlagnahmt nur weil man einen Pass von einem &quot;Falschen&quot; Land besitzt. Jetzt wird auch noch der Finanzplatz der Schweiz vollständig zerstört. Man muss töricht oder Dumm sein, sein Geld noch in der Schweiz zu lagern. Wir werden wieder Mausearm wie 1846..."
UC-bA-LCZ4iIMSqVTadWwEIg,@real8352,2023-03-20T14:42:47Z,"wieso &quot;Dein&quot; Geld auf dem Konto? Solange &quot;auf dem Konto&quot; ist es Bankeigentum! Das weißt Du doch eigentlich, lieber Marc."
UC6aDTeouf-O2gJBIuS-Bf-w,@annimueller6623,2023-03-20T14:37:15Z,"Sehr interessant, danke"
UCYASTokNCvSvJuSHo11AOyw,@JokerElmering,2023-03-20T13:29:18Z,Zum Glück hab ich kein Geld 😂
UCJW5jKV2FzDn8nDCft7Bqbw,@starkstefan8644,2023-03-20T13:19:39Z,Geil 😂😂 du Opfer.💥👍🥳 Danke für deine Mühen
UCfWj-1NxP93S5I15OwhyFnw,@lesstalk,2023-03-20T12:49:40Z,"Schuld am aktuellen Bankencrash sind nur die Kryptowährungen, die deshalb jetzt unbedingt verboten werden müssen. Das jedenfalls posaunt der ehemalige belgische Finanzminister von seinem Sitz im Europaparlament heraus. Dann muss es wohl auch so sein. Sonst müsste man ja diesem Politiker eine vollkommen fachliche Inkompetenz unterstellen."
UCFPwcUQHjVix-7mLR6XTmRA,@fonssolis4912,2023-03-20T12:38:58Z,Hallo Marc danke für die Info wie immer Top 👍🏻. Hast du vielleicht eine Idee für die Rücklagen von Wohngemeinschaften (Eigentumswohnungen) das Geld wird ja auch entwertet 🤔
UCNEGse8zfmiDd0JDNVZlLXg,@yeschuamaranatha2773,2023-03-20T12:21:42Z,"Also ehrlich, da verliert man ja die Contenance. Mal davon abgesehen, das die CS 50.000 Mitarbeiter (17.000 in der Schweiz) hat. Die dürfen jetzt alle zittern. So ein Coup ist ja wie aus der Räuberpistole. Da werden, ohne spezielle Not, die Aktionäre über ein Wochenende (Börse geschlossen) per Notverordnung enteignet. Geht`s denn noch? Aber um die Absurdität noch auf die Spitze zu treiben, erhält die nächste hinkende Gurke in der Börsenlandschaft der Schweiz jetzt für 3 Milliarden nicht nur eine Bank, die einige Analysten immerhin noch mit realen ca. 30-40 Milliarden Wert bewerten. Dazu spülen entwertete CS Anleihen satte 17 Milliarden direkt in die Portokasse. Der Staat legt noch 100 Mia Kredithilfe mit drauf. Das ist kein Schnäppchen, das ist ein Geschenk. Ungefähr so, als würde man über das Wochenende die Commerzbank enteignen und der Deutschen Bank schenken. Wie ein Schwank aus einer Bannanenrepublik. Da wird ja wohl kaum mehr jemand jemals wieder in irgendwelche Bankwerte investieren wollen, oder?"
UCrM_kW-DQRLO69EWm2VwQjQ,@malikye5230,2023-03-20T12:15:14Z,Es sind die Archegos Bullet Swaps die Ihnen um die Ohren geflogen sind. Diese enthalten u.a. Gamestop shorts.
UCXjM528Y4gciLOGdyHPWV9g,@08User15,2023-03-20T12:14:53Z,"Lieber Marc, Du hattest mal in einem Interview Deine Erfahrungen u. Erlebnisse aus Argentinien erzählt, könntest Du dazu mal eine Folge machen in der Du den Ablauf, Deine Gefühle und die Reaktionen und Geschehnisse erläuterst, diese Erfahrung von jemanden zuhören, der so etwas tatsächlich mal live erlebt hat, würde sicher gut aufklären und dankbar angenommen werden und Du hast sicher den einen oder anderen Tipp der vielleicht in der Zukunft Gold &amp; Bitcoin wert sein wird für eine solche Situation. Danke"
UCQcTMRnGCe_C97OAInPdfEQ,@sgkesra-te4yc,2023-03-20T11:59:47Z,"Das einzige was 100% sicher ist, dass NICHTS sicher ist"
UCsI0cvBByZa5p4TmeFsNuoA,@th.k3298,2023-03-20T11:44:40Z,"Wie einfach niemand &quot;Credit Suisse&quot; richtig aussprechen kann, ich drehe durch"
UCqLv1HHOVqgLLKX5KqUqeug,@patrickpirzer4080,2023-03-20T11:28:41Z,Credit default swaps? Nicht schon wieder! Hat man denn aus 2008 gar nichts gelernt?
UCutKf6XqARrQdXj8ISnchRg,@Chad-jx1jm,2023-03-20T11:22:50Z,haben den noch so viele Geld über um sich Gedanken zu machen wo sie es hinschaffen?  ich frage für einen freund....
UCSZK83QtbqXkawEPM8jsm4g,@technikfictionnatur--6939,2023-03-20T11:22:29Z,"Und am Schluss kommt wieder das Bitcoin Mantra, Investition ins Nichts....netter Versuch."
UCK6i86630ULpSFQxWMw7pSA,@irocode,2023-03-20T11:21:55Z,"Nach dem ich kein Geld habe...  Kann es mir eigentlich nur besser gehen. Ich hoffe, dieses kranke System bricht ein"
UC_k56aHcDj0p7qd_rXL8c3g,@monkeyperson9392,2023-03-20T11:21:38Z,"<a href=""https://www.youtube.com/watch?v=WV-E7VAQNi4&amp;t=250"">4:10</a> okay muss mein Abo beenden. dachte ich krieg nen Herzinfarkt. Bin noch nicht mal alt oder so. Muss sowas sein?"
UCIvh6cAnrcQMn80R--fbLIw,@maitreyipiontek6241,2023-03-20T11:20:37Z,"Es wäre interessant zu wissen, an wen der Erlös für die Credit Suisse geht??"
UCylorUJLKTJzqNoXbCM-9xg,@sk8_boarding,2023-03-20T11:17:42Z,"Das momentan heftigste Gefühl ist, dass die Lebenszeit der Vorfahren auch vernichtet wird. Meistens schon zu alt um sich aktuell noch zu orientieren oder zu handeln"
UC2MmhK7t9hXUXZe7c5qd0XA,@peterpfeifer4296,2023-03-20T11:14:52Z,Hier werden ja die Begriffe wild durcheinander gewürfelt.  Und die Unterschiede in den Problemen bei der SVB und CS völlig außer Acht gelassen.  Katastrophal.
UCIz03W2ByCz_OmAUL_AuLLg,@_PeterParker,2023-03-20T11:04:24Z,🧡✌🏼
UCz2dDTd5UB5RxaoUgGv-omg,@mxnubtw117,2023-03-20T11:02:34Z,🤣🤣🤣🤣🤣🤣🤣🤣🤣🤣🤣🤣🤣🤣🤣🤣
UCSaqR1UG5T4Ampz3Jo5APzA,@alxchg2232,2023-03-20T10:48:35Z,Meide Investment in der Schweiz!!! Eigentumsrechte ist Geschichte!!!
UCPUr-DlvGSXvZg1mrsWea0Q,@ursulaschopp3266,2023-03-20T10:47:22Z,Danke für die Information!!❤
UCnBTrxqU4Ys1kOWcUxm_sNA,@matthiassedlmaier3466,2023-03-20T10:34:16Z,"Die Crashpropheten.. Immer warnen, selten passiert was und wenn mal was ist &quot;Ich habs doch gesagt&quot; 🤣"
UC64hbvzHZZcb_kIjjzvO0rw,@avica001,2023-03-20T10:31:35Z,hattest recht🎉
UCyZ9fiu1aFs-cqKFOlduKCg,@LaplantFilm,2023-03-20T10:08:54Z,Danke Marc
UCeg17W8azrEvkUDSyGEsSZw,@andreaspielmeier4933,2023-03-20T10:04:50Z,Ich will ich will auch so eine Maschine!!!!!!!!!!!!!!!!!!!!!!!!!!!
UCj7u5JxNUAOZZ0uO8BqndmQ,@MikeSharkMovies,2023-03-20T10:03:21Z,Versuche mal in Deutschland dein ganzes Geld abzuheben🤔🤔🤣🤣🥳🥳
UC4R6ticoMUkIMkIlcQDUVyw,@firmamichaelis6571,2023-03-20T09:56:51Z,Sollte man nun aus Aktien raus?
UC64zqq90A-LgSidQ_CKib7g,@smile1984LE,2023-03-20T09:54:57Z,Schade eigentlich das die Hoodies 60€
UCWlcvxDIN414ftWpH80V6kg,@Luise_Z,2023-03-20T09:39:15Z,Einfach nur Danke Alf... äh Marc! 😂👍🙏<br>Top Video wieder einmal! 👍
UCOB7mabIshFD8KXn1JQylIg,@Chomar_Hunter,2023-03-20T09:24:50Z,Die Welt ist grausamer als sie glauben
UC0BQYB5-MfmceZOgHQNLD3A,@wskibbe5903,2023-03-20T09:23:40Z,"Der MICHEL u.a. hat/haben eben seit 100Jahren (1923 !!!) NIX dazugelernt, und so wird es auch bleiben (siehe Einstein:“Zwei Dinge sind unendlich, die menschliche DUMMHEIT....“), wie sich immer wieder zeigte 😡🤗"
UCUO2Y9jcgozVL_o5qVFibiA,@masepodcast32,2023-03-20T09:15:09Z,Top Beitrag!
UCXn1gjqECrLkpUOGFHj0anA,@nickleeson6315,2023-03-20T09:13:46Z,"Greensill, haha! Hab da mal kurz gearbeitet. Ganz schräge Crew :-)"
UCMsw0jNiWWe2Z6ZBHUiDI1g,@raschoooooooooo,2023-03-20T09:11:40Z,Du Opfer
UCOSQTaxvCJncVZPAHYVvnrg,@dcxrumble4234,2023-03-20T09:05:04Z,"Wie immer top Video, top Inhalt!!!<br>Deine Videos als Lehrmaterial in Schulen, ich hätte es mich damals jedenfalls gewünscht !"
UCWFgf1TsItP6lqpZya2GSlA,@RattosLocosHannover,2023-03-20T08:47:49Z,"Das interessante daran ist, dass r/superstonk bereits spekuliert hat, dass credit suisse 2023 fallen könnte, nach dem der Skandal mit Archegos Capital öffentlich wurde und credit suisse die Bullet swaps, etc. übernommen hatte."
UCH8YdVKVq8rVv8JRfjY4Kuw,@th0reodinsson547,2023-03-20T08:45:28Z,"Top Video, wie immer einfach Bombe :) Vielen Dank!"
UCHgv096_9nqi0TqlvbouIFw,@ML.t_CHgR,2023-03-20T08:41:09Z,Credit Suisse: Wie sehr wirst du uns auseinander nehmen??<br>Marc: JAAA!!🔥🔥☝🏼
UC8sDDD93mX5fVtRNJno81Tg,@neomorpheus9007,2023-03-20T08:38:28Z,"Schön das du deinen Humor nicht verlierst, dank Bitcoin."
UCVRTmDfIwSom24sM69yJ6HA,@odin8807,2023-03-20T08:15:42Z,"Schon passiert. Gut 3Mrd legt UBS laut Pharmalobbist Berset auf den Tisch für die CS. Intressant, die SNB legt 100MRD als Garantie aus für den Deal, und der Bund steht im gegenzug mit 100mrd für die SNB ein. Mir egal solang sie nicht unsere Steuergelder dafür nehmen 🤡"
UCDJkwczm5M-n84eiEVbvcuQ,@jorgzuhlke494,2023-03-20T08:13:37Z,Danke für ihre Videos 👍👏🎉
UCeO9Mp6YMgl3Nx3wSWGb3_A,@aleglibert8630,2023-03-20T08:03:33Z,Wir brauchen  UdSSR  zurück ( weltweit).
UCzsuUtnIE8Lb8MZcEPRQZiQ,@allroundlife9890,2023-03-20T07:41:18Z,"<a href=""https://www.youtube.com/watch?v=WV-E7VAQNi4&amp;t=91"">1:31</a><br>😂😂😂❤"
UCED-nTN4-Ypks1nhW8_UeRA,@rainerweidlich3821,2023-03-20T07:38:50Z,"Die globale Finanz-Mafia, im Gewand der &quot;Regulierungsbehörden&quot;, rettet den Finanzmarkt 😂<br>Kann man sich nicht ausdenken....."
UCFVRPnIKmh9js13HQ2uHw5w,@youtubeprofile9495,2023-03-20T06:42:48Z,"Solange putin Krieg führt, sollte man nicht in Bitcoin investrieren. Verluste sind einprogrammiert."
UClNupqJ-XQStXb7QlWss4HQ,@informationen102,2023-03-20T06:41:39Z,BTFP = BY THE F... PEOPLE 😂
UCmLvwQlw5COpQcfgPOUyQRw,@dennislanger8053,2023-03-20T06:35:32Z,Manchmal geht es auch den größten Schmarotzern an den Kragen 😁
UCX6MOZHgxzf4eDII-3Liimw,@peterhahnefan,2023-03-20T06:17:29Z,Danke fürs Video. Aber 84Mio Deutsche? Eher nur noch 60Mio.😢
UCsYwqiasvEBTtfI0RqkUCsQ,@ce9488,2023-03-20T06:07:54Z,Was für eine korrupte Bande.
UCi6fehDZQhV9GBKOjgQh9Ug,@diebitcoinakademie,2023-03-20T06:00:57Z,Dein T-Shirt gefällt mir👍🏼😅
UCugglcagD3oVKX0IGa0QSsQ,@oliverklimach4177,2023-03-20T05:47:36Z,"Diesmal mit einer extra Portion Humor, gefällt mir. ^^"
UChBxPZIy_8jB9lHoizYiWTA,@avantgardedoboj4810,2023-03-20T05:46:45Z,"WER KANN BEWEISEN DAS ES DEN GENANNTEN WIRKLICH SCHLECHT GEHT?TUN SO ALS OB:DAS WAS SIE MIT CORONA NICHT GESCHAFFT HABEN,MACHEN SIE MIT ANGST ÜBERS GELD."
UCjXFdCZjPn0nFaANKTj0oDA,@christians.5579,2023-03-20T05:32:35Z,"<a href=""https://www.youtube.com/watch?v=WV-E7VAQNi4&amp;t=252"">4:12</a> scheiße leer 😂"
UCJALhOTk2FoFIVo8_pvra3g,@xxgsxr41,2023-03-20T05:31:08Z,"Volksbanken sind Genossenschaften, die sind mit überhaupt nichts abgesichert mal so nebenbei.<br><br>Und wie hoch ist doch gleich das Sicherungskapital einer GmbH...?<br><br>Mal überlegen? 25k!?<br><br>Ja dann viel Spaß bei der Einlage Sicherung 😂<br><br>Dann dürfen die beim Bail Gesetzlich unser Geld in eigene Aktien ausgegeben, will man unbedingt in Portfolio haben, Aktien einer Pleite Bank. <br><br>Mir reicht es den Chart der CS über die letzten 20 Jahre anzusehen... Nö Bank Aktien im Portfolio Nein danke."
UCZXYLmI4BpFlwm7s7DvL1sA,@h.m.b.1129,2023-03-20T05:18:29Z,Mit Bitcoin ein goldiger Ausweg. Danke
UCJI1z3j1MoTGJ1aD4SSFriA,@vbhchack4617,2023-03-20T05:13:28Z,"Ich gehe davon aus, dass Krypto krachen wird und dann muss man einsteigen!"
UCDpDjrbZkPTCWqaIEx5rwHQ,@markus1226,2023-03-20T04:51:49Z,"Wie kann eine so korrupte Bank systemrelevant sein? Ganz einfach sie sind nicht systemrelevant, sondern sie sind das System. Danke Marc für deine bzw eure gute Arbeit."
UCow5EVM7wDLJrgJFAMsPkvA,@kanalSwissBlade,2023-03-20T04:43:31Z,"Offerte UBS 25 Rappen pro Aktie🤣Machte ursprünglich eine Kfm Ausbildung bei der damaligen SBG, heute UBS und die heutige Form der Banken ist meilenweit vom damaligen System entfernt. Kundenschalter entfernt, persönlichen Kontakt nur noch bei Anlagegeschäften erwünscht, der ganze Rest wird seit Jahren an Automaten verwiesen respektive die heutige Generation macht ihre Zahlungen per E-Banking. Heisst, Gebühren für die Kontoführung werden verlangt, der Kunde macht dies aber selbst - ein genialer Schachzug. Für mich haben sie gar keine Berechtigung mehr, bin seit 2 Jahrzehnten bei der Postfinance, welche allerdings auch an der Gebührenspirale dreht und Dienstleistung für die &#39;normalen Kunden&#39; einschränkt."
UC4J8uTmniI3Jve9Ib82Vn3g,@Grinnser,2023-03-20T04:32:54Z,"Schuld sind die EU Sanktionen, die Schurkenstaaten haben schnell verstanden das ihr Geld in der EU nicht sicher ist."
UCB3EoLpYX-9AMXC83g_h3lg,@klausschwab7480,2023-03-20T04:24:04Z,warum sprichst du nicht über ISO20022 Swift Blockchain Migration (CBDCs) XRP/Ripple Usw
UC4J8uTmniI3Jve9Ib82Vn3g,@Grinnser,2023-03-20T04:21:46Z,Meine BTC gehen hoooooch 😂
UCTk3lXJY3vp22MPmw7F04Vg,@b-music9329,2023-03-20T04:13:59Z,"Die Aktionätre der Credit Suisse erwachen heute Morgen und ihre Aktie ist noch 76 Cent (Rappen) wert.<br>Respektive wird für dieses Wertäquivalent auf UBS-Aktien überschrieben. Zudem wurden 17 Milliarden an Anleihen auf NULL gesetzt, sprich Totalverlust."
UCMctbMuDWOrcSzqUkIWcxnQ,@josef889,2023-03-20T04:10:31Z,"Das ist hochkriminell,  es werden die Aktionäre  der Credit Suisse einfach  betrogen! Wo ist das Übernahmeangebot an die Aktionäre  der Credit Suisse?? Was passiert hier gerade???🐑🐑🐑🐑🐀🇺🇸🤑"
UCTmf8P9SGwBz9VZ4OxatlvQ,@Saudi.UsRaeli,2023-03-20T03:26:39Z,"Welche große Bank dieser Welt (insbesondere US Banken)  sind an keiner  Geldwäsche beteiligt und das im großen Stil? Es geht nicht um Geldwäsche und dergleichen.. Diese Bank ist in Ungnade gefallen, weil politisch unkorrrekt, gell? So wie seiner Zeit D-Bank.."
UCBFcEp2HyIs1ldA0hqCjROQ,@ChristopherJohnsons,2023-03-20T03:25:53Z,"Wenn die Politik die Wahl zwischen &quot;Ende mit Schrecken&quot; und &quot;Schrecken ohne Ende&quot; hat, dann wählt sie zuverlässig letzteres, weshalb ich mal an die Fortsetzung der (gallopierenden) Inflation glaube."
UCrpeDLaBDzphTnurAPaLyFA,@tihomirvukovic1499,2023-03-20T03:24:17Z,Wären die Schweizer mal lieber neutral geblieben....
UCOcQWBflMIWl0RTuhnMX3pA,@falunrod,2023-03-20T02:41:51Z,"Toll! Bankenkollaps! Dann sind meine Schulden bei der Bank auch bald weg? …Das wäre doch gerecht, oder?"
UC52oHnyDd0D98aANCGE7bYw,@desdemoni6347,2023-03-20T02:30:28Z,"Wieso sollten Chinesen in Europe investieren, wenn sie befürchten müssen, dass es ihnen bald wie den Russen geht, deren Investment eingefroren wurde und die vielleicht bald enteignet werden? Unternehmen in Ländern, die solche Aktionen durchführen werden es schwer haben, Gelder im Ausland zu bekommen, selbst bei &quot;sagenhaften 7 %&quot;."
UCziwCV4GTh7qjBD3PZjDbDQ,@nyahanan,2023-03-20T02:28:19Z,"Der riesengroße Banken oder Finanzcrash wurden schon vor vielen Jahren vorausgesagt, scheint wohl der Zeitpunkt gekommen zu sein, die Banken planmäßig kollabieren zu lassen, ich denke dass ist nicht zufällig!"
UCL_Ctmi-y7i1Y5-7dB8du1Q,@markobauherr4156,2023-03-20T02:20:55Z,Einfach geil 😂👍
UCk9NKeRHgl3bBuxozk7ASiw,@flyingsnow311,2023-03-20T01:31:53Z,"Wenn die 2 Trillionen in den Markt kommen, wie gross ist die Gefahr, dass das Vertrauen völlig erodiert und uns das ganze System um die Ohren fliegt?"
UCk9NKeRHgl3bBuxozk7ASiw,@flyingsnow311,2023-03-20T01:29:14Z,"Konnten die Staatsanleihen nicht abgesichert werden, aus Sicht der Banken, welche sich dahingehend stark engagiert haben? Die wussten ja dass die Zinsen am steigen sind."
UCK-rGiZwjpSU-mtTRg0a2Kw,@3D-PHASE,2023-03-20T00:52:39Z,4&#39;15&quot; hahahaha 😂😂😂
UCHbCS8EcTCBWtJA7v0fCQww,@adsoftware,2023-03-20T00:29:50Z,"Ein Riesen Popanz. Eine Bank übernimmt eine andere Bank. Schon tausend mal passiert. Wenn wir uns um eines keine Sorgen machen müssen, dann sind es die Banken. Die Banken sind die Inkarnation des Kapitalismus."
UC4BOaXIgR5dbhox-sEdN7Jg,@volkerfranz3024,2023-03-19T23:44:43Z,Kein Friedrich ohne Bitcoin Werbung
UCma6fnQdqwUumTLtwmavpDA,@kerstingraupner3876,2023-03-19T23:33:41Z,"Bin Laie aber wenns stimmt, dass der Bitcoin DS-Geld ist und gerade beendet wird ..ist auch mit einem Schlag der Bitcoin weg."
UCEQZK2QiPzALxLtixiRf7kA,@dietmardoring800,2023-03-19T23:33:23Z,"Schweizer Nationalbank &quot;reingraetschen&quot; ganz einfach mit 50 Mrd und &quot;enter taste&quot; auf dem laptop zur elektronischen Ueberweisung an CS, alles aus duenner Luft, wirklich kein &quot; reingraetscher&quot;"
UCtExnpe60Y0bQfDo_1ZZGMA,@christianstephan7545,2023-03-19T23:28:10Z,"Herr Fiedrich hat mit allem recht nur ist Bit-coin und Co nicht genauso betroffen<br>wenn keiner Bitcoin haben will ?, Gold und Silber mus kein Geld mehr erbringen erschaffen <br>es ist schon er schaffen gefördert und neues Gold und Silber zu fördern wird immer <br>teurer und hat jedes Geldsystem im in der gesamten Geldgeschichte meisterhaft <br>bestanden Im übrigen Silber ist in 20 Jahren alle, was die bezahlbare Förderung betrifft.  könnte man von Bit-coin auch sagen nur braucht man Bit-coin in der Elektronik ?"
UCuo5CVELmHmR5tJWPNiHyPg,@alexanderleeb8535,2023-03-19T23:27:57Z,10/10 Content
UCLV8RomYaxKSuhajXqHyzEA,@TheMusikfan007,2023-03-19T23:25:22Z,Geldabfluß ?<br>Haben wir nicht Fiat Money. Geld aus dem Nichts. Laut Franz Hörmann und Marc Friedrich verleiht die Bank weder die Einlagen noch ihr Eigenkapital. Mit dem Kreditvertrag entsteht das Geld aus dem Nichts.
UCxtg1mSsRFQodzPi14tt80A,@dynamic2k3,2023-03-19T23:11:24Z,Credit Suisse ist &quot;gerettet&quot; also weiter LONG in den Märkten
UC3HHks_HqPXLfMjn7PbRxfg,@lostmoose7352,2023-03-19T23:07:53Z,"👉 Ich bin Rentner.<br>Viel Geld hatte ich Gott sei Dank nie aufm Konto.<br><br>Schon in jungen Jahren vertraute ich Sachwerten, <br>und nun im Alter halte ich hauptsaechlich Leergut und Fressalien.<br><br>Und meine Bank ist aus Eiche und mit Wertapieren decke ich mich nicht ein, sondern zu.<br><br>😉"
UCVMcG59z7nn15zVVszxIEbQ,@Bodo.Schafskaese,2023-03-19T23:05:06Z,Hast du nicht sowas ähnliches vor drei Jahren bei ZDF vorhergesagt? 😅
UCFw1KpkHEzz8kEY4DUed37Q,@maximboroda8939,2023-03-19T23:01:45Z,danke sehr interessant 😢
UCFvxsaCxvD0K23nCGXVlJeQ,@Gtf306,2023-03-19T23:01:27Z,Der Crash kommt !
UC7BrDL_6Lg7vTy2BS3iCNog,@michi5003,2023-03-19T22:55:01Z,Banken pleite na und? Erzähl mal was neues...
UCygcDGv5-9enpkmlW2SpbEw,@Niro.47,2023-03-19T22:50:59Z,😂😂😂
UCQ-kDspAkXNtylIB3sTdjSg,@hansmeiser8133,2023-03-19T22:50:13Z,Marc wir bräuchten mehr typen wie dich hier 🤙🤙
UCjtrpd4DogcIHHWcyH7XFAw,@a.w.8393,2023-03-19T22:44:53Z,"Top Video Marc, wie immer gut zusammengefasst und auf den Punkt. Wieder muss man den Leuten leider sagen „I told you so“ aber es ist noch nicht zu spät. 🧡 Danke👍"
UCz6YqhCTMzzm0UUp-Ofz4Jg,@saschapfersdorff2834,2023-03-19T22:37:32Z,.... keine Panik <br>   Die Schweiz rettet ihre Banken. <br>   Reichtum rettet das BankenGrld💲. <br><br>Es geht weiter .... <br><br>😅🙈 &quot; Du Opfer &quot;. <br>BankenRettung 💲
UCyRxt1RfZgagMa1FPp3qb-g,@jorgthomas9750,2023-03-19T22:30:07Z,"Vermögenssicherung, man ich bin froh wenn meine Rente für einen Monat reicht!"
UCz8lObxiHYvxKJ9SMiIyH2A,@TheHelltrasher,2023-03-19T22:29:46Z,...wegen ALF😍....LOVE ♥
UC5Xfms6-f4r4I8SQLSErwYg,@mmercato7174,2023-03-19T22:25:07Z,"Aktionäre werden einfach enteignet...<a href=""UCkszU2WH9gy1mb0dV-11UJg/ygF1XpGUMMjk8gSDrI2wCx""></a>"
UCV53gPEsBBHIrv9shMK2OAw,@Strawbreaker,2023-03-19T22:03:20Z,"Da das neue digitale Zentralbankgeld eingeführt werden soll, muss man das alte System schlecht machen..........damit die Menschen das neue akzeptieren!  Und keine Zeit haben darüber nachzudenken ob es was Gutes oder was schlechtes ist!!! Und DAS sehen wir gerade. Alles ist orchestriert und geplant."
UCyyY6kwtAWog2SUPBbHdq6A,@bi141008,2023-03-19T22:01:53Z,"Hi Marc, müssten nicht die Stablecoins in die Knie gehen sobald die Banken fallen?"
UC0ajAopEfGmkHXudi48vlAg,@bergheini3547,2023-03-19T22:00:28Z,"Wie stehts gleich wieder im letzten Buch, zur Frage wann der Euro nicht mehr in dieser Form existiert? &quot; Der Drop ist 2023 gelutscht &quot; <br>Als Rettung wird der digitale Euro  in Form Währubgsreform kommen. <br>Lange Wochenenden  wie Ostern und Pfingsten sind die passenden  Tage. Vielen Dank für die wichtigen Warnungen"
UCCSaok5YrnjE7J1Vi-ifICg,@123Tobi,2023-03-19T22:00:17Z,Was sagst du zum FED Statement.. das Zentralbanken aus Japan England USA und EZB usw. jetzt zusammen die Liquidität sichern wollen !??
UComDeNaeAk6WJcBE3xwH5hw,@rogimiller,2023-03-19T21:57:58Z,Am ende sogar 200mrd. 😑
UCSA7wuiND1zP71fydEtFO4Q,@RenkTV7,2023-03-19T21:57:08Z,"ALF, na auf jeden. Den schaue ich auch schon die letzten zwei Wochen. Einfach eine grandiose Sendung. Gut, dass mein Vater mit mir hin und wieder ALF, als ich ein Kind war, geschaut hat."
UCWtXPKePy1LlC3Qc9kHufCw,@hansenpansen2314,2023-03-19T21:55:05Z,"<a href=""https://www.youtube.com/watch?v=WV-E7VAQNi4&amp;t=255"">4:15</a> Lol !!"
