commenterID,UserName,Date,Text
UCbvin2OrZILiVu0onM4SYFg,@andreg3862,2023-06-12T09:37:26Z,Unser nächster Wirtschaftsminister!
UCxzW-9XZPpta9zD0g5bLHgg,@michaelwolff1035,2023-06-12T09:32:23Z,"Was sind Banken ? Auf manche können wir uns selber drauf setzen. Andere wollen uns weismachen, wir würden nichts mehr besitzen, aber glücklich sein. Glücklich ? Wie die Bäcker in Afghanistan, die im Stehen schlafen können, wegen dem Mohnkuchen mit Schlafmohn ? Verzeiht mir bitte die dumme Frage."
UCqL2tfTVVMb2li7WQFFaJcA,@dersisko6858,2023-06-12T09:28:44Z,"Ich muss Markus Krall zwecks einer Gold gedeckten Kryptowährung enttäuschen. Die wird es nicht geben. Ich erkläre hier auch warum: Wenn das Gold gestohlen wird oder anderweitig verschwindet, dann kann keine Blockchain helfen. Materie ist nicht digitalisierbar.<br>Das einzige, was man in der Blockchain speichern kann, ist der Beweis für erbrachte physikalische Leistung. Durch diese verrichtete Arbeit wird ein neuer Block gefunden. Das wäre so, als wenn man das Foto des Goldfinders und die Transaktionshistorie auf die Goldmünze prägen würde und dies durch 20.000 unabhängige Kameras kontrolliert würde."
UCb5UD1-Ecw0H02I-Y13fxOQ,@SuuuperMariio,2023-06-12T09:25:17Z,"Wettert über Politiker, dass sie keine Ahnung haben und uns die Welt erklären. Und jetzt erklärt er uns die Welt - und das noch polemisch.  🤣"
UCosgKOOobiwLhUsILlCfZvA,@jama197,2023-06-12T09:22:32Z,"Super aufgearbeitet, auch für Nicht-Ökonomen. Leider bin ich an einer Stelle anderer Meinung beim Thema Rente. Wenn ich mir in meinem Bekanntenkreis die Höhe der Rente ansehe, hat fast jeder eine Höhe ungef. wie das Bürgergeld. Nur diese Leute haben gearbeitet. Ich finde schon, dass diese Menschen arm sind und ich glaube auch, dass es leider keine Einzelfälle sind. Aber trotzdem geschieht nichts, weil viele Betroffene sich dafür schämen und im Verborgenen bleiben."
UCOhQD791wguNlr15k1bAVuw,@sabrinawinchester7954,2023-06-12T09:16:28Z,Ich hab das Gefühl ich guck Volker Pispers.<br>Besser kann man es  nicht mehr auf den Punkt bringen
UCjsrBPDNqi9NEM3lLenVgUQ,@manfredpaul386,2023-06-12T09:15:57Z,"Entweder sind die ungeimpften schuld, oder der klimawandel!"
UCjsrBPDNqi9NEM3lLenVgUQ,@manfredpaul386,2023-06-12T09:13:58Z,"Was ist mit den kanzler los? Der ist doch nicht durch den bildungsnotstand gegangen, oder war der in der schule so schlecht?"
UCMm-lhrcqS4CF9CoVHM8VJg,@wurzelbert84wucher5,2023-06-12T09:12:48Z,"Krall ist ja beinah Kabarettist geworden. Das ist aber verständlich, wir erleben ja auch tagtäglich Realsatire in Berlin ;)"
UC9O4h1A90BR3wkIhkzRT9fA,@landwirtmeister6063,2023-06-12T09:10:56Z,Mein größter Respekt für Marc Friedrich und Markus Krall
UCxC-T79aV8EBYNOrqt_0bsg,@canerkarahan7649,2023-06-12T09:01:14Z,Immer wieder gut
UCGuRDrn0VL_EV2SnyQNEp5w,@generation50pluspfadfinder58,2023-06-12T08:56:54Z,"Warum nennen wir es nicht beim Namen? Wir sind im 3. Weltkrieg, der nicht subtiler und hinterhältiger gefüfhrt werden kann als er schon wird. Die Strippenziehen sind die an den Spitzen jener Konzerne, die Partner von Investoren wie Black Rock, Vanguard, etc. sind und  die Oligarchen der Welt, die einer perfiden Macht- und Geldgier (oder schlicht und einfach dem Bösen) verfallen sind. Korruption und Filz gehen so tief wie ein Wolkenkratzer hoch ist. Unsere Politiker und ihre Helfershelfer sind ihre Marionetten, die es sich jetzt gut gehen lassen, weil sie iwann auch &quot;ü&quot; sind... wenn alles zerstört ist, kann es neu und hoffentlich anders besser wieder aufgebaut werden. (Nichts Anderes waren unsere &quot;klassischen&quot; Weltkriege)<br>Wie ich immer gerne sage &quot;gleicher Kern, neues Mäntelchen."
UC6VtJpvo0bnZdHxNGUPPxtQ,@daraneitzke3806,2023-06-12T08:53:49Z,"Großartig Herr Dr. Krall. Danke. Wie ist es zu erklären, dass trotz Lierferketten Problemen bspw im Auto Sektor die Gewinne teils auf Rekordniveau sprudeln?"
UC6sL7uPpxRitoHiITOtxQrA,@gabibruckner9004,2023-06-12T08:47:31Z,"Vielen Dank Marc Friedrich für die tollen Menschen die sie zu ihreren Veranstaltungen einladen. Herr Krall schätze ich auch sehr. Er ist sachlich, empathisch, klug und erklärt alles so toll dass auch der Leihe alles gut nachvollziehen kann."
UC45GZClzu-oJCCgiGK6pfxw,@wasserelementar,2023-06-12T08:42:21Z,wunderbar &lt;3
UCM0vImcmPIaebFCrgm2pEkw,@AndreasGerhardStark,2023-06-12T08:41:28Z,"Warum lässt man nicht mal Krall in einer Talkshow des Öffentlich-Unrechtlichen-Rundfunks auf dem Kinderbuchautor treffen. Das ist doch, was die Leute interessiert!"
UC_WBx-LCXeQU7OQ8ATcmQ3Q,@ronnymaer9448,2023-06-12T08:32:23Z,Danke dafür. Wie immer sehr lehrreich.Grüße aus Ostdeutschland.
UCO305DfW8toVOdJXwaYihLA,@rolandhorzella4991,2023-06-12T08:14:22Z,Krall ist Pflicht ! - Großartig.
UCjTwYeVlOjLfvqEaFpPRXOA,@k.a.7845,2023-06-12T08:12:13Z,Gold ist gutes Geld in der Zeit vor der Digitalisierung und vor dem globalen Handel. Jetzt ist es Bitcoin
UCinkmnEH9iBn4TmnGfoY9lQ,@SunMetropol,2023-06-12T08:11:36Z,hat euch schon mal jemand geschrieben das euer intro deutlich zulaut ist im vergleich zum rest Video?<br>🤷‍♂
UCPAbEZdHtiI6dcB-wvWNn4A,@sdigit1,2023-06-12T08:09:25Z,Nach 8 Minuten kann ich nicht mehr. Abo gecancelt!
UCzc2B8oHcBlvVM-uBAqdgyA,@trachtler007,2023-06-12T08:08:21Z,Herr Krall sie sind ein Traum!! Solche Politiker würden wir für dieses „shit hole“ brachen!!!🙏🏻🙏🏻🙏🏻🙏🏻
UCvLi0-xfCY_MX0O9PlgTdtg,@karleiber7351,2023-06-12T08:01:39Z,"Marc Friedrich hat offensichtlich ein Problem mit seinem Selbstempfinden. Er trägt Bart, das soll ihn weiser, älter und erfahrenen darstellen. Hat er nicht nötig, denn die Worte zählen, nicht die Optik!"
UCQmSOzT6ACgix-swHlOx5yg,@enricobuzzetto7986,2023-06-12T08:00:57Z,"Markus Krall hat so langsam erkannt, dass er seine Ansichten als Kabarett verkauften muss, damit mehr Leute zu hören"
UCW9T2f1VtSlhM0syDEJO1BA,@johanwise9713,2023-06-12T07:59:51Z,👍🥂 Könnte die neue Anstalt werden 🤔 die Leute müssen nur noch lernen - etwas Wirtschaftskunde und an den richtigen Stellen zu lachen.
UCanpRyPKKG29MjGKJ7gl0GQ,@h.m.8483,2023-06-12T07:48:42Z,Ich bin der Atlas Initiative beigetreten 😊
UCm46_ZRWJqbZCKdpXYIwYyg,@beataruchniewicz6366,2023-06-12T07:44:00Z,👏👏👏👏
UCHm2dNUaokH6UxImgErkreg,@zuhorermeinung2125,2023-06-12T07:43:11Z,...fallen  am 2 Stock vorbei und bleiben mit dem Auge an einen Nagel hängen ......Ihr Fazit ist doch nochmal GUT gegangen.......?!
UC-OFzTVwf2EjHwM7slPwaEA,@danielmaier735,2023-06-12T07:42:01Z,Vielen Dank Herr Dr. Krall für Ihren hervorragenden Vortrag.
UCdaLox_RYs4gPdJHbD2IQlg,@coljaschoppe8670,2023-06-12T07:41:33Z,"Hervorragend!<a href=""UCkszU2WH9gy1mb0dV-11UJg/Iv90XouTLuOR8gSxxrToBA""></a> Aber auch der beängstigende Vortrag den ich seit langem gehört habe..."
UCstl78hvWAdJiXThRvmrrGg,@dagofan2008,2023-06-12T07:37:39Z,"Die Grünen und ihre zugehörige Lobby wissen, dass sie, wenn überhaupt, nicht so schnell wieder an die Macht kommen werden. Deshalb lautet meine These, dass wir bis zur nächsten regulären Wahl durch ein ungeplantes, eher inszeniertes Umweltereignis ein Pogrom mit entsprechenden Folgen haben werden."
UC-vJrJgsg-JvmmZHGFEjklQ,@dr.sustain6754,2023-06-12T07:35:55Z,Der Punkt mit der Energieeffizienz von Solarpanelen ist hart falsch! Sie haben den Faktor 25 und mehr! Etwas viel Theater. Als Kabarettist ok.
UCZGmS-BUBHTpKtCxUIg-Bdg,@quantume3200,2023-06-12T07:31:13Z,das erzählt Herr Krall nun schon seit mind. 10Jahren.......der Zusammenbruch wird kommen.......tja  er kommt immer noch nicht....was stimmt daran nicht ?
UC-CjFSyDU6Di3xqwtS8Me-Q,@gerdstackler4067,2023-06-12T07:16:32Z,"Zum Thema „Gendern“, kann ich nur sagen: …gendern dud der Sachse wenn sein Boot umkippt 😉"
UCArhO46U05c3p2CAdNT7GCQ,@maxheadshot3287,2023-06-12T06:55:02Z,Die SVB-Pleite hat jetzt aber mit Derivate-Handel nichts zu tun.
UC7UJTKZQpKQaR29KX59SmTA,@minimusmaximus9135,2023-06-12T06:53:49Z,Die politiker verdrängen so lange bis die hütte brennt und das blut die straßen herunterläuft.
UCY4H86fdt09iwVInF2AtysQ,@matthiasfrick2020,2023-06-12T06:44:34Z,So klare Aussagen mag ich!!!   Wer’s nicht versteht hat ein Loch im Kopp!!!!
UChVTW1QUqcnhh3ei9UQvYtg,@thedude579,2023-06-12T06:44:33Z,Ich mache konsequent 0 Tage Woche.
UChVTW1QUqcnhh3ei9UQvYtg,@thedude579,2023-06-12T06:41:10Z,Der Staat ernährt seine Diener und beraubt seine Bürger.
UCjK363m0PGs09ijM-pxfXTQ,@Karlotto606,2023-06-12T06:36:28Z,"Danke Herr Krall! Ihre Vorträge und Sachinhalte sind immer wieder erfrischend und lehrreich!<br>Für mich ergibt sich nur immer wieder die Frage: Können wir uns jemals wieder von diesem Wahnsinn befreien? Bekommen wir einen Tribünenplatz, wenn die Verantwortlichen fallen?"
UCsbjYabkk7cA9rWaI-mKHOQ,@D18699,2023-06-12T06:36:05Z,Danke das ihnen gibt und für uns mit mit wichtigen Infos Aufklärung geben.👏👏👏👏👍👍👍👍👍
UCRZIMXfkOnIe9jl8C-IVe_g,@elisabethsteverding3623,2023-06-12T06:29:27Z,"Top 💯👌👍.<br>Markus Krall, ein Herr mit Humor und geballter Kompetenz. ❤🙌"
UCk2pi7i9tCDRe0D_lC1ZDMA,@opusopalindividuelleredels5343,2023-06-12T06:14:11Z,Rüstung aus moralischen Gründen ein NOGO
UCYjazK8KpBGOtmK3BLi3PBg,@Florian24,2023-06-12T06:07:12Z,Comedy steht Ihm gar nicht
UC7UJTKZQpKQaR29KX59SmTA,@minimusmaximus9135,2023-06-12T06:06:49Z,Hybris.nur ein anderes wort für arroganz .ein zeichen für dummheit.die ist unendlich.
UC_UV3TtLAy8FMOuXvJT79Ag,@niklasjentzsch3795,2023-06-12T06:01:25Z,Sehr guter und interessanter Beitrag!
UClaPHR6kgMl68GRCA5X0TXA,@A.F.202,2023-06-12T06:00:11Z,Nur ein Wort: SUPER!!!
UC9l1P8oAlPUfQ4JLKslZuBw,@muckxi,2023-06-12T05:52:05Z,"Man kann diese bedrohlichen Themen nicht besser referieren. Würde man den gesamte intellektuellen Vorrat in der Ampel subsumieren, wäre der Abstand zu Dr. Krall immer noch gewaltig. Ihre Beiträge würde ich sehr vermissen."
UCepOAoe2wpdKynsyHidKyJQ,@arianeberger4232,2023-06-12T05:43:22Z,Dr. MARKUS KRALL  immer wieder toll
UCTLHvvOxiHA7wmRu-d8tFXg,@corinabock,2023-06-12T05:38:33Z,Ganz hervorragend analysiert. Danke Herr Krall.
UCkJluChc3jHWaXVDYuX23wQ,@kurt8858,2023-06-12T05:37:59Z,"Herr krall hat leider einen Fehler, er spricht zu schnell. Ich brauche eine gewisse Zeit um seine Worte in Vorstellung umzusetzen und das ist mir schlecht gelungen. Ich glaube, das geht allen so."
UCGUVbrABzX2Uc7HO5liyarg,@ktmrocky65,2023-06-12T05:17:19Z,"Bester Mann wo gibt, er hat durch persönliche Bildung einen Stand erreicht, dem dumpfbacken Bürger die reale Welt zu erklären! Vielen Dank dafür ❤den Rest muss der Bürger selbst organisieren 😩"
UCL9j3XjTi8GzqFZDcnIndeA,@martinackermann2821,2023-06-12T05:02:11Z,"<a href=""https://www.youtube.com/watch?v=NU330fr6hAM&amp;t=1729"">0:28:49</a> „Richtiges GELD“ - heute wie damals etwa 2000 Dollar das Gramm ‚tut GELT‘, oder näherungsweise den gleichen Nährwert wie 1000 Brote hat? Wäre solche Währung denn jemals praktisch gewesen, ohne ihrem 1Brotgleichen in anderer Münze? Die wahre Frage also immer war: Ist Geld auch noch weiter ein Wert im Gleichnis der ‚Waren‘, nachdem diese gewesen wie gegessen waren? Oder haben wir diese uralte Frage nur vergessen, seit wir „es satt haben“ nur satt zu werden vom Gelde?"
UClRiT5d4OuNQFatTnbcoN5g,@d.m.8088,2023-06-12T04:47:04Z,"Markus Krall&#39;s absolute Expertise ist jedesmal ein besonderes Vergnügen, seinen Worten zu folgen - nicht nur inhaltlich, sondern auch rhetorisch ist er einer der ganz Großen. Mega Danke Marc fürs teilen."
UCxKiYkoM1foMNfQhmvIz8cQ,@tr8thin,2023-06-12T04:47:01Z,"Ein interessanter Gast, auch für die World of Value Talkshow: Rainer Flassbeck"
UC9OB4FuXbTL0MsOnLYnjndg,@stefanf.2540,2023-06-12T04:44:59Z,Herr Krall hat durchaus auch Zukunft als Standup Comedian bzw Kabarettist. <br>Themen gibt es ja leider auch mehr als genug.
UCKzqtSNwhg4GIilPkAnq2DA,@damayrmartin4855,2023-06-12T04:16:20Z,Bei solchen Zahlen wird einem nur mehr schwummrig.
UCEtVrJO19FxkDznFW_cVNew,@cookeatliverepeat8815,2023-06-12T04:00:13Z,"Inflationsbereinigt sollen wir seit 1999 ein Schrumpfen der Wirtschaft von knapp 50% haben, ob der Herr Krall das bestätigen kann ?"
UCHmstGAYqaoJVYm1RcaNdaQ,@Martin-wr9zx,2023-06-12T03:59:59Z,"Danke fürs hochladen , sehr interessant 👍"
UCGNMlyF9Pp1PtH3sQLznoaQ,@BULL.RUN.SINCE.2008,2023-06-12T03:45:53Z,"Markus Krall ist grossartig und eine Bereicherung für Deutschland, was man nicht vom Systemling und Fondgebührenmillionär Andreas Beck behaupten kann."
UC65Wm8ps-WnKiM9_feO-shA,@christianherrmann3677,2023-06-12T03:42:08Z,"»Freiheit, Gleichheit, Brüderlichkeit!« – Schwärmer haben diesen Ruf erfunden; Schurken machen sich ihn zunutze.<br>-<br>Otto Ernst<br>🙏Danke Herr Dr. Krall🙏"
UCoxVqFdvuAzFwf9VUk7t51g,@SouVinT07,2023-06-12T03:23:44Z,"Geniale, einfache Beschreibungen für Sachverhalte, die klar sichtbar sind (bei klarer Sicht)."
UCeyhWs9Pa7gtfbKdDSlrmHA,@thehungergames8918,2023-06-12T03:20:16Z,Awesome analysis 🤗
UC4DrB3Pwh-lBRzPf_m_22Dg,@DrHans-RudigerZimmermannTheore,2023-06-12T03:16:08Z,Schöne Grüsse aus Lima an Dr Krall und danke für diesen wertvollen Vortrag. In Peru sieht es sehr viel besser aus.
UCDo4ksMKuEJ3YZYLiKIVTfA,@rimijob3917,2023-06-12T03:14:40Z,"Wieso &quot;DIE DÜMMSTE ENERGIE POLITIK DER WELT&quot;? Man schaltet alle Stromerzeuger aus, und betreibt alle Heizungen und E-Autos mit Strom. Das ist CLEVER, denn man hat keine Verschmutzung bei der Stromerzeugung und betreibt alles mit Strom, die alle KOBOLDE in den Leitungen über Jahrzehnte GESPEICHERT haben. Das ist doch nicht DUMM sondern WAHNSINNIG, aber doch nicht DUMM. Na gut, die WAHNSINNIGEN WÄHLEN diese WAHNSINNIGEN, aber wie gesagt, nicht die DUMMEN."
UChvSUPcUo1ZZS-0QzG9ZRZw,@xy7191,2023-06-12T02:39:46Z,💙💙💙
UCktGCZNOMznKTQlPha154mw,@Grryograu777,2023-06-12T02:24:21Z,Ich bin für Langjährige Gefengnisstrafen für Korupte Politiker!<br>Und Landesveräter.
UCFlP6aPjDG8XzsOlldbxTqA,@KrahTechnology,2023-06-12T01:54:33Z,sehr gut !
UC4bTIvcjnOuDR3w6fSiSLqQ,@RaimundWoitinek,2023-06-12T01:10:56Z,"Der Spruch passt auch gut: „Es ist erbärmlich anzusehen, wie die Menschen nach Wundern schnappen, um nur in ihrem Unsinn und Albernheit beharren zu dürfen und um sich gegen die Obermacht des Menschenverstandes und der Vernunft wehren zu können“. Ein Goethe Spruch, der auf die amtierende Regierung und rund 90% unserer deutschen Bevölkerung, der diese selbstmörderische Regierung gewählt hat, leider zutrifft."
UCPW-zOQBxRsROEYINwttRtA,@UHRsprung,2023-06-12T00:08:52Z,danke
UCIecdYl9MqqbId1uXRsTPCQ,@evelinschuster931,2023-06-12T00:04:29Z,"Politik leidet an Hausverstand bewusst oder unbewusst, das ist die Frage!"
UC4_mLGSHvYcZUm08hXned-w,@pablopipipopo,2023-06-11T23:59:49Z,Bei der Politik wird ein Vortrag zur Comedynummer. 🎉
UCzxS75qUdJ8fqHVmt8GFQKg,@Aluhuetchen,2023-06-11T23:55:51Z,Dr. Markus Krall ist ein absoluter Kompetenz Booster ! DANKE das sie ihr Wissen teilen ♥️
UCSdYmHXBgdwvIfT-aOcM47Q,@bastianr.4552,2023-06-11T23:53:15Z,Ne
UC6VLKmAO-6URljvM0YnEkyw,@gittaschuster7456,2023-06-11T23:33:06Z,"Faszinierend 🤗<br>Würde im Bundestag keiner unserer Experten auch nur Ansatzweise Verstehen. <br>Der Hausmeister u die Putzfrau verstehen es 😅<br><br>Vielen Dank, wie immer ein Fest."
UCNL8SmTGsI977w2t_gZJfSg,@Traeumer13,2023-06-11T23:32:39Z,Ich habe das als omnipotenten Größenwahn bezeichnet.
UC8zBSsAGhd5Wznv8ts53CrQ,@jochenbruckner1676,2023-06-11T23:25:02Z,Der Kapitalismus hat wieder einmal fertig.<br>✊🏼😄
UCniucKB8p59FQkQgeTZnJIg,@lugosi99,2023-06-11T23:23:24Z,"Absoluter ziviler Ungehorsam von mindestens 60% der Bevölkerung kann diese Bande rauswerfen, darunter wird es nicht klappen. Los jetzt - fangt endlich an!!! 👹👹👹"
UCS653a6vS3FBm9rNKFrvsqg,@jackshit1723,2023-06-11T23:22:16Z,Jeder Satz ein Treffer.
UCcvQugFjPDh2ulI31xgdpgw,@peterpayer9677,2023-06-11T23:14:47Z,Super Video Lieber Marc sehr gut erklärt 😚👌🤟👍
UCsJ3geOaNhnWchDdmsbiwmg,@dancaress2102,2023-06-11T23:08:59Z,👏🤓👍
UCrErHJO1PvO3zho6aofBpAw,@anettestache91,2023-06-11T22:48:01Z,"Verdammt wertvoller Content. Ein Vergnügen Krall zuzuhören. Hoch didaktisch und dabei unterhaltsam. <br><br>Mein Ehrgeiz ist, mein Portfolio old school zu bewirtschaften, ganz nach seinem Sinne, und damit in der „Transformation“ zu überleben."
UCyrFHtNqHKKpYkhcAZbRQfw,@ulligulli5290,2023-06-11T22:46:17Z,Kralle gegen Fratzscher. Für diese Demontage würde ich sogar Youtube-Eintritt bezahlen! 😎
UCOogN4D-7-BCk8OJaWSq2MA,@patrickgrieshaber1897,2023-06-11T22:43:41Z,"<a href=""UCkszU2WH9gy1mb0dV-11UJg/Iv90XouTLuOR8gSxxrToBA""></a><a href=""UCkszU2WH9gy1mb0dV-11UJg/Iv90XouTLuOR8gSxxrToBA""></a><a href=""UCkszU2WH9gy1mb0dV-11UJg/JAJ1XpGpJYnW8wTupZu4Cw""></a>"
UCVo3dHi5-T_n3gHaMURp0Fw,@svenhinrichsen458,2023-06-11T22:36:18Z,M Krall in Höchstform. Es war das reinste Vergnügen!
UCNexKk8JQDIU-cmciN7GO9g,@uschischafer441,2023-06-11T22:27:56Z,Super. Danke👍😊🤗
UCMOJfQhD373u_sWDK93fNmQ,@phextorhd6208,2023-06-11T22:20:29Z,Danke für das Video und danke Herr Dr. Markus Krall👏
UCtavkscoRXFZzoLkhI2OyPw,@Jorge.el.grande,2023-06-11T22:00:04Z,Diese Politiker sind nur im Amt weil das WEF es so arrangiert hat!
UC651a2N51pxt1J4qWMUskVg,@rolandheubusch7539,2023-06-11T21:59:08Z,Es gibt keinen der soviel Wissen so verständlich erklären kann. Das wäre ein Minister für diese kranke Republik. Danke Herr Dr. Krall.
UC3TejbWArXNqW7AzMdjG1LQ,@ZoonCrypticon,2023-06-11T21:57:44Z,"Ist der Vortrag von Mitte April 2023? Korrektur @<a href=""https://www.youtube.com/watch?v=NU330fr6hAM&amp;t=3900"">1:05:00</a> - Vortrag vom 5. Mai 2023."
UCpgdz_OXQmffPowYl4senSQ,@KoMdoN,2023-06-11T21:55:13Z,"Das vielleicht wichtigste Video mit Markus Krall, vielen Dank für das Upload!!"
UCoGJ7mTnsJZ9pKcwZWeU30A,@claudelengyel5098,2023-06-11T21:39:45Z,"Ein genialer, wunderbarer und wertvoller Vortrag, der weiterhilft, Vermögen zu erhalten. Ich gratuliere und wünsche Krall und Friedrich weiterhin viel Erfolg beim grossen Kampf gegen den bürokratischen Mainstream!"
UC8JzIyZJNdhlAezg3PXVLxg,@GuentherMohr,2023-06-11T21:36:17Z,"Hr. Grall hat eine ganz enge deutsche Mittelschicht (nicht Mittelstand) - Perspektive. Ich stimme zu mit zu viel Bürokratie. Aber ein deutsches Lieferkettengesetz mit Menschenrechten ist für viele Menschen in der Welt so wichtig. Bitte lernen Sie auch mal die Menschen kennen, die in Bangladesh Kleidung herstellen oder auf der Stufe zuvor, oder noch vorher in uigurischen Lagern Stoffe herstellen , Hr. Gral!"
UC7GyNfbVMH2O2iN58h2Hsdw,@kamikatze8690,2023-06-11T21:31:13Z,Goldstandard hat in der Geschichte auch nicht funktioniert
UCBJ4KCnvJbCJPdlLr35ATwA,@nixinthis,2023-06-11T21:30:08Z,Wieder so ein möchtegern Propaganderfuzzi :)
UCcmh4m30rynVS1dH1WC3KrA,@orlandomando8486,2023-06-11T21:26:53Z,Er hat BitCoin vergessen ;)
UC3KaxEz15zUJWQRJ7XRr7SA,@renegopfert3960,2023-06-11T21:22:25Z,👋👋👋👋👋
UClLSjOeL8OJxKgLc1hof_dw,@saschafaulhaber8537,2023-06-11T21:19:04Z,"Vorsätzliche Zerstörung Deutschlands <br>Ich erkläre es mal:<br>Nachdem die Amis im Verbund mit den Briten, Deutschland in Schutt und Asche gelegt haben, wurde es im Sinne der Sieger, als Bollwerk gegen die Sowjetunion aufgebaut. Da sich die Grenzen in Richtung Osten verschoben haben, muss auch das Bollwerk nach Osten verschoben werden. Deutschland wird in diesem Kontext nicht mehr gebraucht, daher muss die installierte Wirtschaftskraft, welche benötigt wurde, um das Bollwerk zu ermöglichen, aus Deutschland abgezogen werden, um die USA und das neue Bollwerk (Polen, Ukraine...) zu stärken bzw. aufzubauen."
UCciLfafyu_v5XfmgWmXMBYA,@Room-qy6md,2023-06-11T21:12:58Z,"Preisfrage: Wer hat am Ende das ganze Geld bzw. die Werte dahinter?<br><br>Die wollen aber gar kein edelmetallbasiertes Geldsystem, sondern ein digitales Zentralbankgeld.<br>Dann startet das System zu einer neuen Runde mit anderem Geld. Und der Vorteil - wer politisch nicht spurt, dem wird der Geldhahn zugedreht.<br><br>Wird bestimmt ein total tolles System. :P"
UCypEWpS1yjGbkUnhuKjsyoA,@keenghost,2023-06-11T21:12:32Z,"Ich könnte mir sogar vorstellen, dass die Zentralbanken den Weg der Deflation / Bankenkollaps gehen werden: Alle Banken bis auf ein paar Ausgewählte pleite gehen lassen, aber alle Kundeneinlagen per CBDC (Stichwort e-Euro) garantieren. <br><br>So hat man mehrere Ziele auf einen Schlag: 1. Ein hochzentralisiertes Finanzsystem (=volle Kontrolle über die Finanzwelt) und 2. totale Kontrolle über die Menschen per CBDC.<br><br>Sie werden diesen Kollaps wohl nur mit einer weiteren inszenierten Krise durchbekommen: Ich könnte mir eine allumfassende &quot;Cyber-Attacke&quot; vorstellen oder einen größeren Krieg oder was auch immer anderes sie aus dem Hut zaubern."
UC2zs2cCLx9CtmX7Qg5NxNfQ,@ChristineR02,2023-06-11T21:10:10Z,"Wenn im Kapitalismus das Elend beseitigt wurde, liegt es vielleicht daran dass die arbeitenden Menschen Geld dafür bekommen haben für ihre Arbeit und zwar gerade nur so viel wie der Arbeitsmarkt es erzwungen hat und so wenig, dass Unternehmensspitzen das 1000fache an Gewinne einfahren konnten."
UCkDDeo7RHIrm7puLlCcZJJw,@Tantali1,2023-06-11T21:08:35Z,Grandios!
UC8JzIyZJNdhlAezg3PXVLxg,@GuentherMohr,2023-06-11T21:08:08Z,"Überrascht oder erstaunt? Bin Volkswirt und Psychologe, beschäftige mich mit dem Auskommen in materieller Hinsicht, genauso aber zwischen Menschen und mit einem selbst. Das Feldrandwissen ergänzt."
UCPTg8PglDhR62S06ND2b-mA,@LindenbergerPAV,2023-06-11T21:00:08Z,So wahre Worte! Danke!
UC16hu7n5KQTfc_j4HVdOgkg,@podolski1982,2023-06-11T20:57:13Z,Vielen Dank Herr Krall es ist ein Vergnügen ihnen zuzuhören.👌👌👌👌
UCRVdaP_6toqFozI2jB4YSrg,@JensN113,2023-06-11T20:55:50Z,"&quot;Die Geldmenge verläuft exponentiell&quot;<br>Super Erkenntnis Sherlock, wie soll die denn sonst auch verlaufen bei exponentiellem Wirtschaftswachstum"
UCqu1xJ5GHjZCl-bUpzULTgA,@wind-surfer,2023-06-11T20:53:47Z,👍👍👍
UCMQRL_yT36Q7gRHc4p-5Slw,@vinncentle,2023-06-11T20:52:33Z,Wie immer ein genialer Vortrag von Markus Krall - Chapeau 🎉
UCs-xB93T8lClO-JOndoEHbw,@silvioseeber558,2023-06-11T20:47:59Z,"Danke Marc ,,danke Markus"
UCrE642GoTnfzQiozAnSn5mw,@frankensmann,2023-06-11T20:42:53Z,Sehr fesselnd und spannender Vortrag! Könnten Sie nicht mal öfters sowas machen? Die besten 112 Minuten die ich je gesehen habe!
UCnTwkgRIB-d9dsNFCgu9rdw,@alterschwede12,2023-06-11T20:41:53Z,"Ja auch ich gebe es durchaus zu und ich glaube fest daran, dass es den menschgemachten klimaschwindel gibt 😎"
UCGazib28KzFGD99Wrk_ecEw,@NURANONYM,2023-06-11T20:40:52Z,"&quot;Politik leidet an Hybris!&quot; NEIN!!!!<br>Politiker leiden an Hitleritis! Eine kranke abartige psychische Persönlichkeitsstörung, die durch Schuldkomplexe hervor gerufen wird. Schuldkomplexe machen krank - oft ein ganzes Leben lang. Das Ergebnis kann man in der BRD sehen."
UCxKPyxW6Xd-7tu--z_GNV4w,@dirkkaluza9939,2023-06-11T20:40:19Z,"Super Mann,  weiter so😊"
UCSARdiEKXei5dSzckoWoKRw,@LiliRankine,2023-06-11T20:39:30Z,"Wunderbar! Hervorragend! Awesome! 👏👏👏 Bravo, lieber Herr Dr. Krall! 💯🔝"
UCF76DqKG1ZQcQRGYpUJmvkg,@ond6862,2023-06-11T20:33:26Z,Krall ist einfach eine Naturgewalt
UCcN3lptLVqBGHBhnTmJEN4w,@jensbecker9331,2023-06-11T20:31:34Z,Dr. Krall für Deutschland 🇩🇪!
UCbGN4ycbt_p_Iw7iQ-Uvy9w,@fredymader1750,2023-06-11T20:31:25Z,"Ein interessanter Vortrag. Aber die Aussage oder die Hoffnung<br>„Danach wird es eine neue Welt geben.“  ist einfach so nicht wahr. Denn wenn sich die Menschen nicht äendern, werden Sie weiterhin Babys töten (abtreiben), lügen, betrügen, neiden, hassen usw. Nur Reue und die Hinwendung zu Gott durch Jesus Christus könnte uns helfen. Aber das wollen wir nicht, weil wir dafür zu stolz sind.<br>Wir werden uns lieber in einen neuen menschlichen Retter oder den letzten, schrecklichsten Diktator verlieben. (Antichrist)<br>Lesen Sie die Bibel und Sie wissen Bescheid."
UCNHhhv6tfXqMWAqIaumGKZQ,@tomashelm5247,2023-06-11T20:30:47Z,"Bitte mal genau darüber nachdenken, was das Zerreißen/das Zum-Stillstand-Kommen der Lieferketten (lt. Krall im Gegensatz zu 1923 - damals nicht passiert!) bedeuten wird... Wer könnte in D eine (wenigstens teilweise) goldgedeckte Währung und wie kurzfristig einführen? Außer der Bundesbank sehe ich nichts und niemanden, das bzw. der/die das bewerkstelligen könnten. Ist die Bundesbank tatsächlich vorbereitet und dazu in der Lage oder wird sie ggf. dann daran gehindert, wenn es an sich nötig wäre? Was weiß Herr Krall zum Thema zu berichten? Wie lange wird es dauern, bis die elementarsten Lieferketten wieder einigermaßen funktionieren (Energie, Wasser- und Lebensmittelversorgung, elementare Dienstleistungen, wie medizinische Versorgung und öffentliche Ordnung und Sicherheit)?"
UCSCQ01HzpqlzIsMuk2Z16VA,@toledokatana4566,2023-06-11T20:30:13Z,Kickball Change
UC494m6pQ8MPcS_alIrp6gaA,@Simon-lv2qi,2023-06-11T20:29:59Z,Marcus Krall ist der Eckart von Hirschhausen für die liberale und freiheitlichen Menschen. <br>Der Vortrag hat mich positiv überrascht. Die Menschen müssen aufwachen
UCzK3X5LCIpvKAvPJjbLAA5Q,@MyFunkyShit,2023-06-11T20:28:57Z,Super Vortrag.Markus Krall ist nicht nur ein Top Wirtschaftsökonom und Aktienspezialist sondern auch ein Klasse Kabarretist.
UCfmoPMbLdQ3jRS9E5VnaIXw,@rallefreifahrt6630,2023-06-11T20:26:38Z,"Ein paar Minuten Normalität und danach hat man dann leider wieder Scholz, Baerbock, Habeck und die Knallbirnen von SPON, Zeit und ARD zurück."
UCcQ5ji4XfuJPu-oZCeW_NvA,@oliverschmid605,2023-06-11T20:24:33Z,Im Keller ein paar tausend Liter Schnaps hilft durch jede Krise. Schnaps und Zigaretten waren schon immer die Währung in Krisenzeiten.
UC98G4OfqReYrrX5BFC54a3g,@christianrauter6102,2023-06-11T20:23:04Z,👍👍👍👍👍👍👍👍👍👍👍👍👍👍👍👍👍👍👍
