,Unnamed: 0,TweetId,UserId,UserUsername,Date,Location,Tweet,Media,Likes,Retweets,Comments,Polarity,Sentiment
377,377,1640567959625121792,1172908292441542656,FrediSeiler,2023-03-28 04:14:16+00:00,Schweiz,roth vertrau schon lang futsch kommt spat bitt futsch vertrau schlecht ganz konkordanz unfah pfeif demokrati gefuhrt rahmenbeding gestellt,"Media(photos=[], videos=[], animated=[])",0,0,0,-1.0,Negative
378,378,1640470798098915328,985134328886841350,Dumb__Trump,2023-03-27 21:48:11+00:00,,langsam eindruck zahlreich bundesweit verhind soll,"Media(photos=[], videos=[], animated=[])",0,0,0,0.0,Neutral
379,379,1640264071848050690,452549107,BurkhardtPhilip,2023-03-27 08:06:44+00:00,Medienzentrum Bundeshaus Bern,finma schluss betont eigenkapital liquiditat genugt hatt dabei lieg probl ganz anderswo betont roth vertrau schon lang futsch kommt spat,"Media(photos=[], videos=[], animated=[])",15,3,2,0.0,Neutral
380,380,1640244927362629634,1089075013712531457,GAMEZAREA_,2023-03-27 06:50:39+00:00,Germany,gewalt lauffeu andreas popps gross befurcht bestatigt,"Media(photos=[], videos=[], animated=[])",1,0,0,0.7,Positive
381,381,1640240096543744001,1618012371905028096,TrumpFansBayern,2023-03-27 06:31:27+00:00,"Bavaria, Germany",wieviel million euro druckt seit monat taglich sich syst rett,"Media(photos=[], videos=[], animated=[])",1,0,0,0.0,Neutral
382,382,1640226990388310016,1550436037717278720,emfndhk21323,2023-03-27 05:39:23+00:00,,csgtdeutsch,"Media(photos=[], videos=[], animated=[])",1,1,2,0.0,Neutral
383,383,1640053578600525825,1271798346949316608,MichaelaLiese,2023-03-26 18:10:18+00:00,"Münster, Deutschland",interessi leut gibt bankvermog bank betrag einlagensicher ubersteigt keur verteilt kohl geldinstitut,"Media(photos=[], videos=[], animated=[])",0,1,3,0.0,Neutral
384,384,1639967162352783362,922525702779387904,julian_liniger,2023-03-26 12:26:55+00:00,"Zürich, Schweiz",deutsch,"Media(photos=[], videos=[], animated=[])",189,23,16,0.0,Neutral
385,385,1639692557063016450,29105288,SandraNavidi,2023-03-25 18:15:44+00:00,"Manhattan, New York",verpasst neu liv interview liv sitz billion unrealisiert verlust,"Media(photos=[MediaPhoto(url='https://pbs.twimg.com/media/FsFbhY1WAAATDRw.jpg')], videos=[], animated=[])",12,2,2,0.0,Neutral
386,386,1639664771342401537,1076019740982894597,CleverFritz,2023-03-25 16:25:19+00:00,"Deutschland, Bayern",kipp kommt scholz versucht beruh beunruh,"Media(photos=[], videos=[], animated=[])",1,1,1,0.0,Neutral
388,388,1639326611651608576,560892332,krypto_Land,2023-03-24 18:01:36+00:00,Deutschland,pleit silvergat silicon valley bank signatur bank first republic credit suiss freiem fall verlust monat nacht bank gerettet,"Media(photos=[MediaPhoto(url='https://pbs.twimg.com/media/FsAOVdgXwAUFn2l.jpg')], videos=[], animated=[])",1,0,0,0.0,Neutral
389,389,1639325739769004050,571669188,ItsPyr13l,2023-03-24 17:58:08+00:00,SOL / Erde,gerad geld konto hol eingefall heut schon geld mehr drauf kuhlschrank schon komplett gefress,"Media(photos=[], videos=[], animated=[])",1,0,0,0.0,Neutral
391,391,1639310516341424143,4213060222,kjeld1234,2023-03-24 16:57:38+00:00,"Truth or Consequences, NM",vertrau hinterfrag,"Media(photos=[], videos=[MediaVideo(thumbnailUrl='https://pbs.twimg.com/ext_tw_video_thumb/1639310471382679568/pu/img/PZIl2uu3L3meWK8o.jpg', variants=[MediaVideoVariant(contentType='video/mp4', bitrate=256000, url='https://video.twimg.com/ext_tw_video/1639310471382679568/pu/vid/492x270/0G-59B-1vGz6B8Yx.mp4?tag=12'), MediaVideoVariant(contentType='video/mp4', bitrate=2176000, url='https://video.twimg.com/ext_tw_video/1639310471382679568/pu/vid/1280x702/OefRTZJH3GAz9RgG.mp4?tag=12'), MediaVideoVariant(contentType='video/mp4', bitrate=832000, url='https://video.twimg.com/ext_tw_video/1639310471382679568/pu/vid/656x360/T0MizEA0eyRtsi2f.mp4?tag=12')], duration=30673, views=None)], animated=[])",3,1,1,0.0,Neutral
393,393,1639308913660117212,55035498,huhuhase,2023-03-24 16:51:16+00:00,Deutschland,brauch neu weg impfung aaah bank sich,"Media(photos=[], videos=[], animated=[])",0,0,0,0.0,Neutral
394,394,1639295537315819525,1511738485018963983,wesleyCvision,2023-03-24 15:58:07+00:00,,erst reaktion deutsch bank pleit geld mehr ironi,"Media(photos=[MediaPhoto(url='https://pbs.twimg.com/media/Fr_ymSyWwAAmOSU.jpg'), MediaPhoto(url='https://pbs.twimg.com/media/Fr_ymSxXoAEOgYR.jpg')], videos=[], animated=[])",6,0,4,0.0,Neutral
395,395,1639290466125463552,1355868462669824001,trulyAqu,2023-03-24 15:37:58+00:00,Lummerland ,irgendwi beruhigt cumexolaf stabil bankensystem spricht,"Media(photos=[MediaPhoto(url='https://pbs.twimg.com/media/Fr_t_S-X0AALZWA.jpg')], videos=[], animated=[])",0,0,0,1.0,Positive
396,396,1639284821733015554,1399784067206463492,Neokon_Zukunft,2023-03-24 15:15:32+00:00,Deutschland,putin plant invasion ukrain crash steht unmittelbar bevor hebt schnell geld klimawandel vollkomm natur prozess bricht syst zusamm gold bitcoin investi,"Media(photos=[], videos=[], animated=[])",15,0,0,0.7,Positive
398,398,1639274092854386688,2713134425,starranger3,2023-03-24 14:32:54+00:00,"Baden-Württemberg, Deutschland",satir hinweis mehr bald ohr fliegt,"Media(photos=[], videos=[], animated=[])",2,1,0,0.0,Neutral
399,399,1639251836803661824,15392486,disclosetv,2023-03-24 13:04:28+00:00,🌍,germanys scholz banking syst stabl europ,"Media(photos=[], videos=[MediaVideo(thumbnailUrl='https://pbs.twimg.com/ext_tw_video_thumb/1639251772509241347/pu/img/dlyL5-k3jaVDkntP.jpg', variants=[MediaVideoVariant(contentType='video/mp4', bitrate=832000, url='https://video.twimg.com/ext_tw_video/1639251772509241347/pu/vid/640x360/4vv0uW-PDm95iUd6.mp4?tag=12'), MediaVideoVariant(contentType='video/mp4', bitrate=256000, url='https://video.twimg.com/ext_tw_video/1639251772509241347/pu/vid/480x270/R2bbRuvEKf9jn03k.mp4?tag=12'), MediaVideoVariant(contentType='video/mp4', bitrate=2176000, url='https://video.twimg.com/ext_tw_video/1639251772509241347/pu/vid/938x526/OlQvq4lAXZAK6lMY.mp4?tag=12')], duration=3166, views=None)], animated=[])",2382,480,948,0.0,Neutral
400,400,1639261189862555649,1635445203996749826,dailyBucks1,2023-03-24 13:41:38+00:00,Germany,verliert heutig handelstag bankenkris voll gang anleg zweifeln standhaft aktuell lag tief stand seit oktob,"Media(photos=[], videos=[], animated=[])",0,0,0,-0.1333333333333333,Negative
401,401,1639261166013693952,1104792411144941568,PIPO1245671,2023-03-24 13:41:32+00:00,,global gigant casino grosst arbeitgeb vernetzt rettung erheb teur schwierig,"Media(photos=[], videos=[], animated=[])",8,1,0,-0.7,Negative
402,402,1639256317620527105,1364847860446072833,SwissCryptoJay1,2023-03-24 13:22:16+00:00,Switzerland,schmiert dank deutsch bank tieranleih fallig zuruckzahl akti fallt zweistell,"Media(photos=[MediaPhoto(url='https://pbs.twimg.com/media/Fr_OorpWwAAQKO_.jpg')], videos=[], animated=[])",9,3,0,0.0,Neutral
403,403,1639254499574284291,1507620094410739712,kretschm8,2023-03-24 13:15:03+00:00,,aktienkur geht sud allmah,"Media(photos=[], videos=[], animated=[])",0,0,0,0.0,Neutral
404,404,1639243087951151106,1322239748203810817,SmusSarka,2023-03-24 12:29:42+00:00,Millatown,apropos geld kont bess geld abzieh,"Media(photos=[], videos=[], animated=[])",1,0,0,0.0,Neutral
406,406,1639227360888201216,1556881089851015168,BDC28588336,2023-03-24 11:27:12+00:00,Deutschland,holt geld,"Media(photos=[], videos=[], animated=[])",0,0,0,0.0,Neutral
407,407,1639215660759646208,1589752141111074818,bull2k23,2023-03-24 10:40:43+00:00,Antartic,deutsch bank,"Media(photos=[], videos=[], animated=[])",0,0,0,0.0,Neutral
409,409,1639204871353307138,2713134425,starranger3,2023-03-24 09:57:50+00:00,"Baden-Württemberg, Deutschland",akti sturzt holt schnell geld konto bevor bank knie geht,"Media(photos=[MediaPhoto(url='https://pbs.twimg.com/media/Fr-gJLjWYAAxTv1.jpg')], videos=[], animated=[])",6,1,3,0.7,Positive
410,410,1638841150718070784,983319134938255360,SilkeLutz,2023-03-23 09:52:33+00:00,"Rastatt, Deutschland",investor furchtet aussag jenet yell elektron fahrt aufnehm,"Media(photos=[], videos=[], animated=[])",1,0,0,0.0,Neutral
411,411,1638642726337134592,114334692,kinra,2023-03-22 20:44:05+00:00,"Berlin, Deutschland",geschwind abspielt einmal wurd gross verbreit onlin ermoglicht,"Media(photos=[], videos=[], animated=[])",0,0,0,0.7,Positive
412,412,1638612899663945728,1242047101518913537,MartinMeinung,2023-03-22 18:45:33+00:00,,verbreitet falschinformation,"Media(photos=[MediaPhoto(url='https://pbs.twimg.com/media/Fr2Fv2qWIBUS-lZ.jpg')], videos=[], animated=[])",3,0,1,0.0,Neutral
413,413,1638569987563552769,5715752,zeitonline,2023-03-22 15:55:02+00:00,"Berlin und Hamburg, Germany",bankenbeb gestoppt ubergreif klar sozial medi heut mehr wucht entfalt fruh,"Media(photos=[], videos=[], animated=[])",6,1,1,0.35,Positive
414,414,1639262751204732929,863279108591112193,AmUetliberg,2023-03-24 13:47:50+00:00,"Zürich, Schweiz",angesteckt kommt sich gewarnt bald werdet mehr lach,"Media(photos=[MediaPhoto(url='https://pbs.twimg.com/media/Fr_UyApXgAIBZR3.jpg'), MediaPhoto(url='https://pbs.twimg.com/media/Fr_UyMLXoAgwOiv.jpg')], videos=[], animated=[])",6,2,0,0.0,Neutral
415,415,1638487057583558656,920633367309275136,ApeGoesToMoon,2023-03-22 10:25:30+00:00,Germany,auss leitzinserhoh heut war blank wahnsinn weit bank anfang schwank ries problem bekomm,"Media(photos=[], videos=[], animated=[])",0,0,0,-0.7,Negative
416,416,1638422341343674368,174222143,GEORG_BALDAUF,2023-03-22 06:08:21+00:00,Vienna,thema gerad breit diskutiert gestrig alt beitrag unternehmenskris zeitalt interessiert,"Media(photos=[], videos=[], animated=[])",0,0,0,1.0,Positive
417,417,1638317240205422592,1360211830682116098,JonaSalKupper,2023-03-21 23:10:43+00:00,"Macabre Drive 69a, Prenzl'berg",twitt bos hast kaputt gemacht,"Media(photos=[MediaPhoto(url='https://pbs.twimg.com/media/Frx42CMWIAE_aAs.jpg')], videos=[], animated=[])",4,0,2,0.0,Neutral
418,418,1638227473371373592,1033362606931804161,traderepublic,2023-03-21 17:14:01+00:00,"Berlin, Deutschland",erst fachbegriff kontext besond haufig erwahnt erklar eigent ganz unkompliziert auswirk eher,"Media(photos=[MediaPhoto(url='https://pbs.twimg.com/media/FrwnDQhWAAEh5uf.jpg'), MediaPhoto(url='https://pbs.twimg.com/media/FrwnMeiWIAUG25l.jpg')], videos=[], animated=[])",3,0,5,0.7,Positive
419,419,1638205179244818438,1326997731244732417,tageskorrektur,2023-03-21 15:45:25+00:00,,verbind punkt ublich verdacht,"Media(photos=[], videos=[], animated=[])",13,2,7,0.0,Neutral
420,420,1638199878525255681,1150730657376722944,simietoile,2023-03-21 15:24:21+00:00,"Zurich, Switzerland",credit suiss einzeln gross scheit neu massiv fail kollaps schweiz kaum ubersteh,"Media(photos=[], videos=[], animated=[])",2,2,0,-0.10000000000000002,Negative
421,421,1638128575269294080,2468099712,Thomas_Wuest,2023-03-21 10:41:01+00:00,Remstal und Stuttgart,nachtrag spielt massenpsycholog prozess rollenur real verlustrealisier durch missmanagement bank ausloserd vernetzt kund bewegt verstarkt,"Media(photos=[], videos=[], animated=[])",1,0,1,0.85,Positive
422,422,1638095124423909376,1447382454516338692,WorldinChange2,2023-03-21 08:28:06+00:00,Earth,kommt bankenkris immobilienkris estv gold kryptowahr hohenflug andreas mannick,"Media(photos=[MediaPhoto(url='https://pbs.twimg.com/media/Fruu1dFWIAAoNcf.jpg')], videos=[], animated=[])",1,0,0,0.0,Neutral
423,423,1638052980455878656,2838254091,nebelspalter,2023-03-21 05:40:38+00:00,Schweiz,war verstaatlich credit suiss bess losung ubernahm bundesrat christoph bloch widerspricht gesprach heftig,"Media(photos=[MediaPhoto(url='https://pbs.twimg.com/media/FruIOsQXgAYRxwy.jpg')], videos=[], animated=[])",7,5,3,0.0,Neutral
424,424,1637918906697277442,1200947872222580736,Manyakmaster,2023-03-20 20:47:53+00:00,El Salvador ,geht raus syst fiat syst gibtv eigentum your bank,"Media(photos=[], videos=[], animated=[])",0,0,1,0.0,Neutral
425,425,1637901012286488583,991962229330374657,MichaelSchwyzer,2023-03-20 19:36:46+00:00,"BL, CH",war bess konnt geschaftsbank risikoarm pleit geh hatt gross glaubigerin befeuert hatt,"Media(photos=[], videos=[], animated=[])",1,0,0,0.7,Positive
426,426,1637896073145380865,1360211830682116098,JonaSalKupper,2023-03-20 19:17:09+00:00,"Macabre Drive 69a, Prenzl'berg",geht geht rein geht geht rein geht geht rein geht geht rein,"Media(photos=[MediaPhoto(url='https://pbs.twimg.com/media/Frr5y9TWAAMnRx5.jpg')], videos=[], animated=[])",8,0,3,1.0,Positive
427,427,1637893782506033177,1047879037769699331,MartinSteirer,2023-03-20 19:08:03+00:00,,heutig video notig information beinhalt handeln erleicht spass,"Media(photos=[], videos=[], animated=[])",1,0,0,0.0,Neutral
428,428,1637858285859504128,4041608926,jocelyn_daloz,2023-03-20 16:46:59+00:00,"Suisse, France",bedeutet abgang ubernahm regionalbank aargau kantonalbank,"Media(photos=[], videos=[], animated=[])",0,1,0,0.0,Neutral
429,429,1637797335685111809,930695606217134080,bit_bucks,2023-03-20 12:44:48+00:00,worldwide,schonwied nach etwa schonmal gerettet befurcht genau daran hochdruck gearbeitet,"Media(photos=[], videos=[], animated=[])",0,0,0,0.0,Neutral
430,430,1637773977954181121,1514844419836502017,Kantiger1724,2023-03-20 11:11:59+00:00,,bailout steh heut usregionalbank blick sonntag fdic gewandt befurcht first republic heut morg vorbors minus,"Media(photos=[], videos=[], animated=[])",0,0,0,0.7,Positive
431,431,1637740791236796416,2514990523,stwboerse,2023-03-20 09:00:07+00:00,Jetzt kostenlos abonnieren:   ,berechn trag bank ahnlich risik herum fall gefuhrt fallt leid schwer glaub bankenkris vorbei genau wiss,"Media(photos=[MediaPhoto(url='https://pbs.twimg.com/media/Frpqi_VXgAAptUZ.png')], videos=[], animated=[])",20,4,2,0.0,Neutral
432,432,1637725481951719425,1549704688190332928,JanoschsWondrak,2023-03-20 07:59:17+00:00,,herr janosch geld braucht gluck genau sieb million sack schein kopf leg kiss gemut ausserd sieb gluckszahl,"Media(photos=[MediaPhoto(url='https://pbs.twimg.com/media/FrpeontWAAE6tA8.jpg')], videos=[], animated=[])",178,39,0,0.0,Neutral
433,433,1637712651907104768,15769118,denniskoray,2023-03-20 07:08:18+00:00,Travelling,general byt credit suiss deal gefahr,"Media(photos=[MediaPhoto(url='https://pbs.twimg.com/media/FrpQfT9XwAA4Hmr.jpg')], videos=[], animated=[])",2,1,4,0.0,Neutral
434,434,1637702882085445632,198093456,DNEWS24Medien,2023-03-20 06:29:28+00:00,Berlin ,abgewendet erstmal ubernahm credit suiss markt weltweit beruh schweiz lasst deal viel milliard frank kost,"Media(photos=[MediaPhoto(url='https://pbs.twimg.com/media/FrpJ_EIXsAAuy-_.jpg')], videos=[], animated=[])",1,0,0,0.0,Neutral
435,435,1637580762256949248,1218326345152913408,susisor17318556,2023-03-19 22:24:13+00:00,,eigent passi gross stil kundengeld abgehob schon passi weiss schon infiziert letzt sicherheitshalb abzieh,"Media(photos=[], videos=[], animated=[])",0,0,1,0.7,Positive
436,436,1637574259831709697,1218326345152913408,susisor17318556,2023-03-19 21:58:22+00:00,,mocht tipp abgeb ubernahm finanzmarkt null beruhigt montag erst richtig losgeht,"Media(photos=[], videos=[], animated=[])",7,1,1,1.0,Positive
437,437,1637557792876658691,114334692,kinra,2023-03-19 20:52:56+00:00,"Berlin, Deutschland",macht oligarch westlich zeigt darin bank gerat polit plotzlich handlungsfah scheint sogar sonntag zusammenfindet gesetz nacht and,"Media(photos=[], videos=[], animated=[])",0,0,0,0.0,Neutral
438,438,1637557343125749761,1360211830682116098,JonaSalKupper,2023-03-19 20:51:09+00:00,"Macabre Drive 69a, Prenzl'berg",war ubrig vorgeh gemass finma recovery resolution planung gibt wohl nebel insolvenz,"Media(photos=[MediaPhoto(url='https://pbs.twimg.com/media/FrnFucQXgAIrs0X.jpg')], videos=[], animated=[])",5,0,0,0.0,Neutral
439,439,1637554116493824002,712925424163110912,HVBesuch,2023-03-19 20:38:20+00:00,"Nordrhein-Westfalen, Deutschland",gibt andauert guck geschicht geld bank platt asset bargeld vorgehalt greift aufzuhalt massnahm,"Media(photos=[], videos=[], animated=[])",3,0,1,0.0,Neutral
440,440,1637523270923612166,707366117,bozwy,2023-03-19 18:35:46+00:00,"Weltbürger, Earth",bundesprasident alain eroffnet medienkonferenz bundesrat unterstutzt ubernahm,"Media(photos=[], videos=[], animated=[])",0,0,0,0.0,Neutral
441,441,1637517847596347392,707366117,bozwy,2023-03-19 18:14:13+00:00,"Weltbürger, Earth",ganz jetzig zeitpunkt bereit abgekartet sach medienkonferenz angesagt,"Media(photos=[], videos=[], animated=[])",0,0,0,0.0,Neutral
442,442,1637506424262598657,162346662,MarcFrings,2023-03-19 17:28:49+00:00,"Erfurt, Thüringen",gegrundet bank taschengeld lag bankenmarkt ernst polit zugibt,"Media(photos=[], videos=[], animated=[])",0,0,0,0.0,Neutral
443,443,1637500981104574468,4262847861,RetoBKeller,2023-03-19 17:07:11+00:00,"Einsiedeln, Switzerland",desast schweiz finanzplatz vertrau fast kundengeld reich leihgab lang ubernimmt bankrun stoppt,"Media(photos=[], videos=[], animated=[])",0,0,0,0.7,Positive
444,444,1637498466887671812,1214311711374630912,AbakusN,2023-03-19 16:57:12+00:00,,deutsch bringt schleunig bankeinlag,"Media(photos=[MediaPhoto(url='https://pbs.twimg.com/media/FrmQLQRWAAAZAz_.jpg')], videos=[], animated=[])",0,0,0,0.0,Neutral
445,445,1637493592858980352,198093456,DNEWS24Medien,2023-03-19 16:37:50+00:00,Berlin ,usdollar bietet erinner wach,"Media(photos=[], videos=[], animated=[])",0,0,0,0.7,Positive
446,446,1637484661541679105,198093456,DNEWS24Medien,2023-03-19 16:02:20+00:00,Berlin ,angst kundenansturm geldhaus mittelgross usbank bitt behord offenbar hilf,"Media(photos=[], videos=[], animated=[])",0,0,0,0.0,Neutral
447,447,1637483025641402377,1377672552,GlassBeadPlayer,2023-03-19 15:55:50+00:00,Switzerland,kund imm wahrschein wieviel geld besitzt wirklich wiss mehr,"Media(photos=[MediaPhoto(url='https://pbs.twimg.com/media/FrmB3lNWwAQT5bm.png')], videos=[], animated=[])",0,0,0,0.5,Positive
450,450,1637474119896780801,1446111642647883778,SpiriRobin,2023-03-19 15:20:27+00:00,,geldautomat heut kund ziemlich beschaftigt,"Media(photos=[MediaPhoto(url='https://pbs.twimg.com/media/Frl6CAyX0AQ6V9v.jpg')], videos=[], animated=[])",0,0,1,0.0,Neutral
451,451,1637467120651870211,1326997731244732417,tageskorrektur,2023-03-19 14:52:38+00:00,,verbind punkt imm sonntag,"Media(photos=[], videos=[], animated=[])",17,3,1,0.0,Neutral
452,452,1637462881133363201,821436339350605824,BetweenPoles,2023-03-19 14:35:48+00:00,,sagt,"Media(photos=[], videos=[], animated=[])",0,0,1,0.0,Neutral
453,453,1637446445094633474,1360211830682116098,JonaSalKupper,2023-03-19 13:30:29+00:00,"Macabre Drive 69a, Prenzl'berg",freitag marktkapitalisier milliard fruh heut sonntag,"Media(photos=[MediaPhoto(url='https://pbs.twimg.com/media/Frlg3IOWIAko0Be.jpg')], videos=[], animated=[])",5,2,0,0.0,Neutral
454,454,1637430174558965760,821436339350605824,BetweenPoles,2023-03-19 12:25:50+00:00,,remind holt geld bank solang geht durft spannend histor,"Media(photos=[], videos=[], animated=[])",5,2,0,0.7,Positive
455,455,1637429033070739457,4622973081,scherzmut,2023-03-19 12:21:18+00:00,"Berlin, Deutschland",olpreis zusammenbruch bank heut,"Media(photos=[MediaPhoto(url='https://pbs.twimg.com/media/FrlQGi2XwAINB9d.png')], videos=[], animated=[])",12,2,1,0.0,Neutral
456,456,1637398441809657856,39561741,IkaKarl,2023-03-19 10:19:44+00:00,Österreich,hindernislauf,"Media(photos=[MediaPhoto(url='https://pbs.twimg.com/media/Frk1MvyWYAIzbbk.jpg')], videos=[], animated=[])",8,1,0,0.0,Neutral
457,457,1637372116923195396,1018245089896947713,p_dyle,2023-03-19 08:35:08+00:00,,vorschlag effizienzsteiger zusammenleg muss kund ansteh auflos kontos,"Media(photos=[], videos=[], animated=[])",2,0,0,0.0,Neutral
458,458,1637354913377165312,1360211830682116098,JonaSalKupper,2023-03-19 07:26:46+00:00,"Macabre Drive 69a, Prenzl'berg",uskolonn scheitert koppeli hoch intellektuell svphinterwaldlerbunzliniveau,"Media(photos=[MediaPhoto(url='https://pbs.twimg.com/media/FrkNnfTWAAAoa31.jpg')], videos=[], animated=[])",6,0,0,0.7,Positive
459,459,1637344675609694208,1397572896227213314,JayXRP2,2023-03-19 06:46:05+00:00,Schweiz,dacht best ordnung,"Media(photos=[], videos=[], animated=[])",0,0,0,0.0,Neutral
460,460,1637340612021059584,37659763,JuergenHerzog,2023-03-19 06:29:56+00:00,"Europe, South-Bavaria :-)",aussag sich letzt ausgesproch wurd war knapp ging gerad diesmal,"Media(photos=[MediaPhoto(url='https://pbs.twimg.com/media/FrkAm4RWIAAh7aF.jpg')], videos=[], animated=[])",2,0,0,0.0,Neutral
461,461,1637250389182431234,1618012371905028096,TrumpFansBayern,2023-03-19 00:31:26+00:00,"Bavaria, Germany",sagt betrug sag pleit rennt geld,"Media(photos=[], videos=[], animated=[])",2,1,0,0.0,Neutral
462,462,1637184047796428802,19710887,ScheterPiff_btc,2023-03-18 20:07:49+00:00,,arm herr sag europa bank deutlich schlecht aufgestellt usbank gibt,"Media(photos=[], videos=[], animated=[])",0,0,0,-1.0,Negative
463,463,1637156934414483456,1605182233391800321,hesperialist,2023-03-18 18:20:04+00:00,Ultima Thule,vermut spatest geld bank hol,"Media(photos=[], videos=[], animated=[])",0,0,0,0.0,Neutral
464,464,1637017881698336769,26458162,spdde,2023-03-18 09:07:31+00:00,www.spd.de,leb vollig zeit blick vergleich finanzkris gesetzgeb bankenaufsicht hatt lehr lehmanpleit gezog einlag deutsch sparerinn spar sich,"Media(photos=[], videos=[], animated=[])",70,15,444,0.0,Neutral
466,466,1637139570448793604,1479060754368241664,PPreungesheim,2023-03-18 17:11:04+00:00,"Frankfurt am Main, Germany",risiko akut macht schnell einschreit stutzung institut notwend,"Media(photos=[], videos=[], animated=[])",1,0,0,0.7,Positive
467,467,1637060491716489220,32434282,MarkDittli,2023-03-18 11:56:50+00:00,Zurich,les walt bagehot lombard street avert panic central bank should lend early freely solvent firm again good collateral punitiv rat nochmal ging darum akut bank rundynam durchbrech,"Media(photos=[], videos=[], animated=[])",39,1,4,0.0,Neutral
468,468,1637131585794260994,874564234520256512,fiatlux80,2023-03-18 16:39:21+00:00,,mann bank schnell rennt bekommt vielleicht paar grosch rausgezerrt,"Media(photos=[], videos=[], animated=[])",1,0,0,0.7,Positive
469,469,1637057935292477443,1562432733565304832,SprechV,2023-03-18 11:46:41+00:00,,hort startschuss,"Media(photos=[], videos=[], animated=[])",1,0,0,0.0,Neutral
470,470,1637048332840255491,1412253920785731586,FinanceIntelli1,2023-03-18 11:08:32+00:00,Switzerland,dah bleib sachwert optimal losung schuldsyst beendet,"Media(photos=[], videos=[], animated=[])",0,0,0,1.0,Positive
471,471,1637043661295722496,1514543370479222788,Motorbikebine,2023-03-18 10:49:58+00:00,,ganz falsch ehrlich bank bos wart kam wart schon drauf bos geld,"Media(photos=[], videos=[], animated=[])",0,0,0,1.0,Positive
472,472,1636450120978800651,1014048749767798784,EugenHani,2023-03-16 19:31:27+00:00,KAnton Bern Schweiz,estland lettland pol unterstutz ukrain ganz massivwirschweiz sollt neutralitatsgeschwurbel einfach scham,"Media(photos=[MediaPhoto(url='https://pbs.twimg.com/media/FrXWth8X0AAC37W.jpg')], videos=[], animated=[])",600,61,76,0.0,Neutral
473,473,1637035336982306820,1451824371719458817,handgotte_s,2023-03-18 10:16:53+00:00,Deutschland,zerstor bankksystem beschleun holt geld bank schon jahr gemacht,"Media(photos=[], videos=[], animated=[])",66,10,18,0.0,Neutral
474,474,1637015759565070339,888808647614222336,CharmingQuokka,2023-03-18 08:59:06+00:00, aus Ischias (hicks 🥂),glaub tatsach ernst,"Media(photos=[MediaPhoto(url='https://pbs.twimg.com/media/FrfZJ6LXwAAc_X9.jpg'), MediaPhoto(url='https://pbs.twimg.com/media/FrfZJ6JXgAAhM4L.jpg')], videos=[], animated=[])",2,0,0,0.0,Neutral
475,475,1637015580774477827,4248730900,Fraulein_Antje,2023-03-18 08:58:23+00:00,,gilt imm erstmal grundsatz gegenteil annehm polit erzahl,"Media(photos=[MediaPhoto(url='https://pbs.twimg.com/media/FrfY_deXoAIO_HI.jpg'), MediaPhoto(url='https://pbs.twimg.com/media/FrfY_dXWAAAJhao.jpg')], videos=[], animated=[])",14,6,1,0.0,Neutral
476,476,1637015089134854145,1618012371905028096,TrumpFansBayern,2023-03-18 08:56:26+00:00,"Bavaria, Germany",pleit pleit pleit scholz geld sich,"Media(photos=[], videos=[], animated=[])",1,0,0,0.0,Neutral
477,477,1637012492386725888,831829643862953984,PerspektiveOn,2023-03-18 08:46:07+00:00,,seit crash silicon valley bank letzt freitag bringt amerikan staat gross meng kapital markt pleit moglich bankencrash vorzubeug,"Media(photos=[], videos=[], animated=[])",7,0,0,0.7,Positive
478,478,1637000523172794368,1089075013712531457,GAMEZAREA_,2023-03-18 07:58:33+00:00,Germany,gewalt kettenreaktion andreas popp warnt glied kett,"Media(photos=[], videos=[], animated=[])",1,0,0,-0.7,Negative
479,479,1636991244273328128,1558724954518163456,WagnerJoac,2023-03-18 07:21:41+00:00,"Leverkusen / Cologne, Germany",finanz bank tief index zerquetscht,"Media(photos=[], videos=[], animated=[])",0,0,0,0.0,Neutral
480,480,1636742821301329921,1400847761394724870,ApeAverage,2023-03-17 14:54:32+00:00,E̶v̶e̶r̶y̶w̶h̶e̶r̶e̶,onc again financ bank deep indexs getting crushed back,"Media(photos=[MediaPhoto(url='https://pbs.twimg.com/media/Frbg55fWYAkl-Lr.jpg')], videos=[], animated=[])",174,55,6,0.0,Neutral
481,481,1636836627568787457,1618012371905028096,TrumpFansBayern,2023-03-17 21:07:17+00:00,"Bavaria, Germany",dank wiss deutsch spar endlich,"Media(photos=[], videos=[], animated=[])",0,0,0,0.0,Neutral
483,483,1636817460253868055,354431847,Club12D,2023-03-17 19:51:07+00:00,* Sol System *,russland sanktion enteign hinterlass spur angst reich asiat chines geld schweiz bank credit suiss abzieh schweiz einlagengaranti frank,"Media(photos=[], videos=[], animated=[])",0,0,1,0.7,Positive
484,484,1636803458165506069,2247483085,ramsesvita,2023-03-17 18:55:29+00:00,Earth_Europe_Germany,gold geht tag kehrt wert papiergeld zuruck entspricht namlich voltair,"Media(photos=[MediaPhoto(url='https://pbs.twimg.com/media/FrcYEgAWAAMu0n1.jpg')], videos=[], animated=[])",0,0,0,0.0,Neutral
