,Unnamed: 0,TweetId,UserId,UserUsername,Date,Location,Tweet,Media,Likes,Retweets,Comments,Polarity,Sentiment
1445,1445,427156475203448833,22814467,AndrBangemann,2014-01-25 19:10:14+00:00,Wuppertal,denk imm guthab bank gehort httptcovzrbhbyvfp,"Media(photos=[], videos=[], animated=[])",0,0,0,0.0,Neutral
1446,1446,427035041084878848,625853917,AberNutzeSie,2014-01-25 11:07:42+00:00,,scheint wohl geld auszugeh bald kino httptcolwmylio,"Media(photos=[], videos=[], animated=[])",0,1,0,0.0,Neutral
1447,1447,414964556654714880,14475663,triologmedia,2013-12-23 03:43:54+00:00,"Steyr, Österreich",zeitlass bereit,"Media(photos=[], videos=[], animated=[])",0,0,2,0.0,Neutral
1448,1448,414499079092465664,470662385,icrfornax,2013-12-21 20:54:16+00:00,Hamburg,problem beim testlauf bess umstell unt kopfkiss merry christmas,"Media(photos=[], videos=[], animated=[])",0,0,0,0.0,Neutral
1449,1449,411029230474903552,479560158,frisch2at,2013-12-12 07:06:19+00:00,#DUbistMEHR,geht osterreich plund sparbuch httptcovxboxh,"Media(photos=[], videos=[], animated=[])",0,0,0,0.0,Neutral
1450,1450,407868658191327232,479560158,frisch2at,2013-12-03 13:47:20+00:00,#DUbistMEHR,erwagt abzug httptcojrwmlmonm,"Media(photos=[], videos=[], animated=[])",0,0,0,0.0,Neutral
1451,1451,407567223407255552,301717082,EchteDemokratie,2013-12-02 17:49:32+00:00,Deutschland,notenbank versucht angesicht turbulenz ansturm httptcolierbqcco,"Media(photos=[], videos=[], animated=[])",0,0,0,0.0,Neutral
1452,1452,405023510747422720,740496960,zeeko76,2013-11-25 17:21:44+00:00,,usbank droh spar gebuhr guthab wohl schon provozi httptcoijpvfggp,"Media(photos=[], videos=[], animated=[])",0,0,0,0.0,Neutral
1453,1453,403056837550821376,479560158,frisch2at,2013-11-20 07:06:53+00:00,#DUbistMEHR,bank zukunft kostenpflicht httptcopqsatdu,"Media(photos=[], videos=[], animated=[])",0,3,2,0.0,Neutral
1454,1454,399126022722830336,625853917,AberNutzeSie,2013-11-09 10:47:13+00:00,,schaff heut httptcofzaupycyjy,"Media(photos=[], videos=[], animated=[])",0,0,0,0.0,Neutral
1455,1455,398115788512837632,353537733,siggka,2013-11-06 15:52:55+00:00,Berlin,deutsch bank pleit geldautomat funktioniert,"Media(photos=[], videos=[], animated=[])",0,0,0,0.0,Neutral
1456,1456,397613368841740288,625853917,AberNutzeSie,2013-11-05 06:36:29+00:00,,ruft schon final enteign letzt aufruf rettet ersparnis httptcozrenueejss,"Media(photos=[], videos=[], animated=[])",0,0,0,0.0,Neutral
1457,1457,397352533641142272,42969356,R34lB0rg,2013-11-04 13:20:01+00:00,Temple of Ninkilim,holt geld bank solang osterreich spar enteign httptcoxycmsatq,"Media(photos=[], videos=[], animated=[])",0,0,0,0.0,Neutral
1458,1458,397065740953866240,14637033,mousseman,2013-11-03 18:20:24+00:00,Behind the baking soda,httptcogdpkhkkoo interessant gibt rotchina,"Media(photos=[], videos=[], animated=[])",0,0,0,1.0,Positive
1459,1459,394712366136295424,625853917,AberNutzeSie,2013-10-28 06:28:56+00:00,,wirksam mittel standig abhorerei war der dreck zahlungsmittel abzulehn,"Media(photos=[], videos=[], animated=[])",0,0,0,0.0,Neutral
1460,1460,386449355521019904,479560158,frisch2at,2013-10-05 11:14:40+00:00,#DUbistMEHR,vertrau bank verlor deutsch spar wenig httptcorovrhivxg,"Media(photos=[], videos=[], animated=[])",0,1,0,0.0,Neutral
1461,1461,386018497815265280,479560158,frisch2at,2013-10-04 06:42:36+00:00,#DUbistMEHR,usbank furcht amerikabitt mitmach httptcobbdl,"Media(photos=[], videos=[], animated=[])",0,1,0,0.0,Neutral
1462,1462,385356545803841536,1093125554,DasGeldsystem,2013-10-02 10:52:14+00:00,Erde,geld staat eigent einlagensicher garanti kein,"Media(photos=[], videos=[], animated=[])",0,0,0,0.0,Neutral
1463,1463,379172789334204416,24859163,Her_Of_Twin,2013-09-15 09:20:12+00:00,,wusst welt linksextr istterrroist,"Media(photos=[], videos=[], animated=[])",1,1,1,0.0,Neutral
1464,1464,379171921977683968,456741823,hddoger,2013-09-15 09:16:45+00:00,,privat bankrun angst lolol,"Media(photos=[], videos=[], animated=[])",0,0,0,0.0,Neutral
1465,1465,378977701463617536,456741823,hddoger,2013-09-14 20:24:59+00:00,,httptcotcxozwqwf lolol privat bankrun,"Media(photos=[], videos=[], animated=[])",0,0,0,0.0,Neutral
1466,1466,375149391050313728,130272303,xxCommander,2013-09-04 06:52:39+00:00,Hier und jetzt,paar monat klein schein abgehob bargeld lieg imm,"Media(photos=[], videos=[], animated=[])",0,0,2,0.0,Neutral
1467,1467,374245840262795264,482793756,Trontir,2013-09-01 19:02:16+00:00,Made in West-Germany,schon geld bank staatlich garantiert weia,"Media(photos=[], videos=[], animated=[])",0,0,0,0.7,Positive
1468,1468,370131343788625920,193024287,Howahkan,2013-08-21 10:32:43+00:00,"47° 25′ 16″ N, 10° 59′ 11″ O",bundesbank gesetz spar vermog bank haftung zwing happy httptcoehtmim,"Media(photos=[], videos=[], animated=[])",1,2,0,0.0,Neutral
1469,1469,364998227445022723,625853917,AberNutzeSie,2013-08-07 06:35:33+00:00,,maximal abheb heut morg nach woch httptcoqnwfymk,"Media(photos=[], videos=[], animated=[])",0,0,0,0.7,Positive
1470,1470,361180305962438656,479560158,frisch2at,2013-07-27 17:44:30+00:00,#DUbistMEHR,kapitalflucht nimmt httptcoujdcvjapvv,"Media(photos=[], videos=[], animated=[])",1,2,0,0.0,Neutral
1471,1471,351766349212692480,1283151752,WerkXYZvacature,2013-07-01 18:16:47+00:00,Nederland,bodechauffeur httptcosjsxenk,"Media(photos=[], videos=[], animated=[])",0,0,0,0.0,Neutral
1472,1472,350883884356993025,625853917,AberNutzeSie,2013-06-29 07:50:11+00:00,,letzt hochoffiziell aufruf gesamt schnellstmog abzuheb httptcomvaohzpk,"Media(photos=[], videos=[], animated=[])",0,0,0,0.0,Neutral
1473,1473,349148552787808256,218540006,rodewijntjes,2013-06-24 12:54:36+00:00,,bankenrett deutschland verlangt prozent zwangsabgab spar verwacht niet httptcoeelwyodqdj,"Media(photos=[], videos=[], animated=[])",0,0,0,0.0,Neutral
1474,1474,349131621217226753,381422684,Boerenfox,2013-06-24 11:47:19+00:00,The Netherlands,bankenrett deutschland verlangt prozent zwangsabgab spar httptcoakcfxgp lees hel verhaal,"Media(photos=[], videos=[], animated=[])",0,0,0,0.0,Neutral
1475,1475,349040321541332992,218916795,sarecha,2013-06-24 05:44:32+00:00,Europe,bank mehr rett legt geldschopfungsmonopol staatlich hand,"Media(photos=[], videos=[], animated=[])",1,3,0,0.0,Neutral
1476,1476,349038244672966658,218916795,sarecha,2013-06-24 05:36:17+00:00,Europe,bank wechseln,"Media(photos=[], videos=[], animated=[])",0,0,0,0.0,Neutral
1477,1477,348362393308499968,625853917,AberNutzeSie,2013-06-22 08:50:41+00:00,,worauf wartet eigent klingelt greift gerad superbill httptcoeptbmvbbkw,"Media(photos=[], videos=[], animated=[])",0,0,0,0.0,Neutral
1478,1478,348352141167046656,625853917,AberNutzeSie,2013-06-22 08:09:57+00:00,,spar freut ganz liegt hand httptcoeptbmvbbkw,"Media(photos=[], videos=[], animated=[])",1,4,1,1.0,Positive
1479,1479,348348861695266817,625853917,AberNutzeSie,2013-06-22 07:56:55+00:00,,verlass darauf panik spar gibt burg wahl httptcoeptbmvbbkw,"Media(photos=[], videos=[], animated=[])",0,1,0,0.0,Neutral
1480,1480,348030101583192065,849486272,visions_s,2013-06-21 10:50:16+00:00,,wozu vertusch passiert steh strass business usual,"Media(photos=[], videos=[], animated=[])",0,0,0,0.0,Neutral
1481,1481,347686424608395264,64675422,MrJohnNada,2013-06-20 12:04:37+00:00,Antartica ,chines interbankenmarkt kollabiert steht welt deflationar schock httptconbdljrjbd,"Media(photos=[], videos=[], animated=[])",0,2,0,0.0,Neutral
1482,1482,347641377015877632,142984550,FORMAT_at,2013-06-20 09:05:37+00:00,Österreich,panik weg gerucht httptcopawdbhwlm,"Media(photos=[], videos=[], animated=[])",0,0,0,0.0,Neutral
1483,1483,334992364747767809,479560158,frisch2at,2013-05-16 11:22:58+00:00,#DUbistMEHR,imm geld bank abholt definitiv schuld,"Media(photos=[], videos=[], animated=[])",2,2,0,0.0,Neutral
1484,1484,331713818705145856,94916470,PROPAGANDAFRONT,2013-05-07 10:15:11+00:00,,geldzykl kommt final hoch httptcogipihyo,"Media(photos=[], videos=[], animated=[])",1,1,0,0.7,Positive
1485,1485,328055010288095234,625853917,AberNutzeSie,2013-04-27 07:56:24+00:00,,lest httptcorhqznnnz,"Media(photos=[], videos=[], animated=[])",0,1,0,0.0,Neutral
1486,1486,326564476138708992,636328656,nullmedien,2013-04-23 05:13:33+00:00,Leutschenbach,auftret wohl deutsch schloinig geld schweiz abzieh,"Media(photos=[], videos=[], animated=[])",1,0,0,0.0,Neutral
1487,1487,325944463316889602,42969356,R34lB0rg,2013-04-21 12:09:50+00:00,Temple of Ninkilim,standard poor bank gefahrd spareinlag osterreich httptcoyzwllkqu,"Media(photos=[], videos=[], animated=[])",0,0,0,0.0,Neutral
1488,1488,321667159128436736,1021961600,iRUN_de,2013-04-09 16:53:21+00:00,Deutschland,holt geld bank bevor spat httptcoqhrkiytc,"Media(photos=[], videos=[], animated=[])",0,1,0,0.0,Neutral
1489,1489,321333324985548800,482793756,Trontir,2013-04-08 18:46:49+00:00,Made in West-Germany,zyp funk bank sprengt doug casey bank bankrupt httptcobpwfxarhw,"Media(photos=[], videos=[], animated=[])",0,0,0,0.0,Neutral
1490,1490,321028649618911232,54280982,HolgerScherer,2013-04-07 22:36:09+00:00,JN39VU,eigent musst morg titeln ruft,"Media(photos=[], videos=[], animated=[])",0,0,0,0.0,Neutral
1491,1491,320990457024892928,482793756,Trontir,2013-04-07 20:04:23+00:00,Made in West-Germany,bundesbank bankeinlag euro ganz sich httptcoanekgxp,"Media(photos=[], videos=[], animated=[])",0,0,0,0.0,Neutral
1492,1492,320553000580050944,1021961600,iRUN_de,2013-04-06 15:06:05+00:00,Deutschland,panik anleg insel verbreitetries httptcoxvqwdqk,"Media(photos=[], videos=[], animated=[])",0,1,0,0.0,Neutral
1493,1493,320552867196985344,1283401044,IRUN_Ruhr,2013-04-06 15:05:33+00:00,,panik anleg insel verbreitetries httptcoqsjwoocvry,"Media(photos=[], videos=[], animated=[])",0,0,0,0.0,Neutral
1494,1494,320533181063364609,213072316,gehtdochnicht,2013-04-06 13:47:20+00:00,Planet Erde ,meldet sturm httptcopnucpsmf,"Media(photos=[], videos=[], animated=[])",0,0,0,0.0,Neutral
1495,1495,320525182496284674,213072316,gehtdochnicht,2013-04-06 13:15:33+00:00,Planet Erde ,zeitgleich abgelenkt httptcovrlyceqycn,"Media(photos=[], videos=[], animated=[])",0,0,0,0.0,Neutral
1496,1496,320521964299112448,45391448,stadfield,2013-04-06 13:02:45+00:00,Gemeng Esch Sauer Luxembourg,gerucht neu zwangsabgab zypr sturm genossenschaftsbank httptcomwqdlduhpp,"Media(photos=[], videos=[], animated=[])",0,0,0,0.0,Neutral
1497,1497,320500890677153795,1021961600,iRUN_de,2013-04-06 11:39:01+00:00,Deutschland,imm mehr mainstream medi bericht darub fall zyp httptcotuxqhjeo,"Media(photos=[], videos=[], animated=[])",0,3,0,0.0,Neutral
1498,1498,320441837561192448,348033879,Cicerofan,2013-04-06 07:44:22+00:00,,bank skandal jorg asmuss httptcovorqwtqbq,"Media(photos=[], videos=[], animated=[])",0,1,0,0.0,Neutral
1499,1499,319336630605455361,625853917,AberNutzeSie,2013-04-03 06:32:40+00:00,,wurd belog betrog httptcoourhwgulq,"Media(photos=[], videos=[], animated=[])",0,2,0,0.0,Neutral
1500,1500,319071392886820866,308500785,Sustainche,2013-04-02 12:58:42+00:00,"Namibia/Germany/Niger, Africa",well problemat wuerd kreditnehm kurz zeit bargeldauszahl zentralbankgeld verlang wuerd,"Media(photos=[], videos=[], animated=[])",0,0,0,0.0,Neutral
1501,1501,319048433656807424,137691131,TARGOBANK,2013-04-02 11:27:28+00:00,"Düsseldorf, GER",interessant zusammenfass lag zyp ausgeblieb httptcotakxebws,"Media(photos=[], videos=[], animated=[])",1,0,0,1.0,Positive
1502,1502,318983675721175040,625853917,AberNutzeSie,2013-04-02 07:10:09+00:00,,sobald mensch girokont abheb schlicht httptcoweeskn,"Media(photos=[], videos=[], animated=[])",0,0,0,0.7,Positive
1503,1503,318643393695735808,257088949,mycomfor,2013-04-01 08:37:59+00:00,deutscher Sprachraum,burg rett mehr milliard ersparnis httptcopfzqayap,"Media(photos=[], videos=[], animated=[])",0,0,0,0.0,Neutral
1504,1504,318312261334749185,125570941,Muschelschloss,2013-03-31 10:42:11+00:00,"Bayern, Deutschland",milliardenabfluss mont paschi httptcozzjnvzg,"Media(photos=[], videos=[], animated=[])",0,0,0,0.0,Neutral
1505,1505,318308330349150208,125570941,Muschelschloss,2013-03-31 10:26:34+00:00,"Bayern, Deutschland",banca mont paschi siena burg siena rett ersparnis httptcofoxzzgencs,"Media(photos=[], videos=[], animated=[])",0,0,0,0.0,Neutral
1506,1506,318259569027592192,27282380,taguerness,2013-03-31 07:12:48+00:00,Bayrische Alpen,bankrun itali burg siena rett ersparnis httptcoqvwtqdzww,"Media(photos=[], videos=[], animated=[])",1,3,0,0.0,Neutral
1507,1507,317952124300435456,319381173,FreeStreetMedia,2013-03-30 10:51:08+00:00,Duisburg,bestatigt guthab httptcomvtagiwc,"Media(photos=[], videos=[], animated=[])",0,0,0,0.0,Neutral
1508,1508,317932509507772417,625853917,AberNutzeSie,2013-03-30 09:33:11+00:00,,habt schon gefragt warum einzig schutz anbietet,"Media(photos=[], videos=[], animated=[])",0,0,1,0.0,Neutral
1509,1509,317925886190039040,625853917,AberNutzeSie,2013-03-30 09:06:52+00:00,,must read pet boehring impression durft httptcousynytwyd,"Media(photos=[], videos=[], animated=[])",0,0,0,0.0,Neutral
1510,1510,317925392612728832,32118751,fils_at,2013-03-30 09:04:55+00:00,Austria,sieht httptcoalezlapm,"Media(photos=[MediaPhoto(url='https://pbs.twimg.com/media/BGl_dcxCIAAi74Q.jpg')], videos=[], animated=[])",0,0,0,0.0,Neutral
1511,1511,317917110393253888,625853917,AberNutzeSie,2013-03-30 08:32:00+00:00,,offiziell aufruf gesamt guthab abzuheb httptcobdoswbiiu,"Media(photos=[], videos=[], animated=[])",0,0,0,0.0,Neutral
1512,1512,317710712568950784,46446876,Knuddelbacke,2013-03-29 18:51:51+00:00,Berlin Grünau,deutsch gejubelt bankrun deutsch ruhig stell,"Media(photos=[], videos=[], animated=[])",1,4,0,0.7,Positive
1513,1513,317710168102158336,46446876,Knuddelbacke,2013-03-29 18:49:41+00:00,Berlin Grünau,kapiert beruhigungspill mehr helf,"Media(photos=[], videos=[], animated=[])",0,1,0,0.0,Neutral
1514,1514,317676277576376323,479560158,frisch2at,2013-03-29 16:35:01+00:00,#DUbistMEHR,neu goodbank geld matratz httptcoiztenbwzy,"Media(photos=[], videos=[], animated=[])",0,1,0,0.0,Neutral
1515,1515,317626874979307520,74260581,Exilregierung,2013-03-29 13:18:42+00:00,Berlin,modern findet wenig medienwirksam bildgewaltignicht wenig drastisch heimisch couch statt,"Media(photos=[], videos=[], animated=[])",0,0,0,-0.25,Negative
1516,1516,317336999633747968,153889126,leoxity,2013-03-28 18:06:51+00:00,"52.012277, 8.699396",ries enttausch radio tvsend zyp httptcodgcsgysvp,"Media(photos=[], videos=[], animated=[])",0,0,0,0.0,Neutral
1517,1517,317333048641347584,36934854,adrianmichel,2013-03-28 17:51:09+00:00,"From Ermatingen, @Bern",primar hysteri medi journalist sturm zyprisch bank httptcoskkuiqbhdo,"Media(photos=[], videos=[], animated=[])",0,0,0,0.0,Neutral
1518,1518,317326444952969216,276168311,ChiefMannion,2013-03-28 17:24:54+00:00,Österreich,scheiss volk einfach sagt einfach krieg,"Media(photos=[], videos=[], animated=[])",0,0,0,0.1333333333333333,Positive
1519,1519,317303585551552512,29744097,devisenalarm,2013-03-28 15:54:04+00:00,Germany,plus bleibt httptcolfgzyntl,"Media(photos=[], videos=[], animated=[])",0,0,0,0.0,Neutral
1520,1520,317298846369734656,16774753,StephanEwald,2013-03-28 15:35:15+00:00,Vienna,nein geht bild schreibt gibt gibt httptcophncdkyka,"Media(photos=[MediaPhoto(url='https://pbs.twimg.com/media/BGdFnqICYAA31ts.jpg')], videos=[], animated=[])",0,0,1,0.0,Neutral
1521,1521,317255909405519873,489222890,luebberding,2013-03-28 12:44:37+00:00,,viel gest warnt heut sich warnung unsinn wovor warn morg,"Media(photos=[], videos=[], animated=[])",1,0,1,-0.35,Negative
1522,1522,317242141791371264,55554468,littlewisehen,2013-03-28 11:49:55+00:00,"London/Camden, Rottach-Egern ",findet vorerst statt viel journalist verstopf bank platz strass,"Media(photos=[], videos=[], animated=[])",0,2,0,0.0,Neutral
1523,1523,317227596192550912,479560158,frisch2at,2013-03-28 10:52:07+00:00,#DUbistMEHR,schafft bargeld httptcojimiqiqx,"Media(photos=[], videos=[], animated=[])",1,2,0,0.0,Neutral
1524,1524,317225789886181376,479560158,frisch2at,2013-03-28 10:44:56+00:00,#DUbistMEHR,moodys droht abstuf handelsblatt httptcoyrfjnbr,"Media(photos=[], videos=[], animated=[])",0,0,0,-1.0,Negative
1525,1525,317225471265886208,479560158,frisch2at,2013-03-28 10:43:40+00:00,#DUbistMEHR,bankenoffn konto leerraum macht httptcotyzghudeoj,"Media(photos=[], videos=[], animated=[])",0,0,0,0.0,Neutral
1526,1526,317224998479749121,479560158,frisch2at,2013-03-28 10:41:48+00:00,#DUbistMEHR,sobald sturm bank begonn macht sinn mitzumach httptcosbrwqoyqa,"Media(photos=[], videos=[], animated=[])",0,0,0,0.0,Neutral
1527,1527,317223018688573443,355059291,BernhardKrall,2013-03-28 10:33:56+00:00,"Wien, Austria, Europe",gibt heut dreifach gefahrenzulag zypriot bank schalterdien,"Media(photos=[], videos=[], animated=[])",0,0,0,0.0,Neutral
1528,1528,317220863839703040,16774753,StephanEwald,2013-03-28 10:25:22+00:00,Vienna,viel teur tvcrews geschickt film paar omis hausbank besuch,"Media(photos=[], videos=[], animated=[])",5,2,1,0.0,Neutral
1529,1529,317218919045812224,124169534,vertig0nix,2013-03-28 10:17:38+00:00,"Terra, Sol System",andererseitsbei euro konto person braucht erwartenod,"Media(photos=[], videos=[], animated=[])",0,0,0,0.0,Neutral
1530,1530,317213870785695744,20675466,neuigkeitenchef,2013-03-28 09:57:35+00:00,"Prenzlauer Berg, Berlin",drei minut,"Media(photos=[], videos=[], animated=[])",0,0,1,0.0,Neutral
1531,1531,317212758376603649,16088480,vollraute,2013-03-28 09:53:09+00:00,Ruhrgebiet,zyprisch minut euro zusammenbrach,"Media(photos=[], videos=[], animated=[])",1,1,0,0.0,Neutral
1532,1532,317205350187139072,124169534,vertig0nix,2013-03-28 09:23:43+00:00,"Terra, Sol System",erfolgreich nachh dran,"Media(photos=[], videos=[], animated=[])",0,0,0,1.0,Positive
1533,1533,317202163438874624,372229938,ProfRieck,2013-03-28 09:11:03+00:00,Frankfurt am Main,interessant alternativ goldstandard geld geldkonstruktion macht unmog abstract les,"Media(photos=[], videos=[], animated=[])",0,0,0,1.0,Positive
1534,1534,317198136231727104,100508247,TotallyTrash,2013-03-28 08:55:03+00:00,"Earth, Solar System, Milky Way, Laniakea",anguck httptcoqliyabijzs,"Media(photos=[], videos=[], animated=[])",0,0,0,0.0,Neutral
1535,1535,317188250525634560,319381173,FreeStreetMedia,2013-03-28 08:15:46+00:00,Duisburg,erst livebild mensch,"Media(photos=[], videos=[], animated=[])",0,0,0,0.0,Neutral
1536,1536,317186485935816706,64801088,chaoscommander,2013-03-28 08:08:45+00:00,"Hamburg, Deutschland",schnell bargeld eingedeckt weiss resteuropa auswirkt habt,"Media(photos=[], videos=[], animated=[])",0,0,0,0.7,Positive
1537,1537,317186132465041408,319381173,FreeStreetMedia,2013-03-28 08:07:21+00:00,Duisburg,offn erwart weit,"Media(photos=[], videos=[], animated=[])",0,0,0,0.0,Neutral
1538,1538,317183094564192256,625853917,AberNutzeSie,2013-03-28 07:55:17+00:00,,voll gang httptcolkmhdqdw,"Media(photos=[], videos=[], animated=[])",0,1,0,0.0,Neutral
1539,1539,317182062064984064,319381173,FreeStreetMedia,2013-03-28 07:51:11+00:00,Duisburg,weg viel,"Media(photos=[], videos=[], animated=[])",0,0,0,0.0,Neutral
1540,1540,317175672961384448,625853917,AberNutzeSie,2013-03-28 07:25:47+00:00,,stell gibt leut stell spass schlang,"Media(photos=[], videos=[], animated=[])",0,1,0,0.0,Neutral
1541,1541,317175355599368193,319381173,FreeStreetMedia,2013-03-28 07:24:32+00:00,Duisburg,scheint wahrschein httptcorsukoelzk,"Media(photos=[], videos=[], animated=[])",0,0,0,0.0,Neutral
1542,1542,317173420070678528,625853917,AberNutzeSie,2013-03-28 07:16:50+00:00,,spat kommt bestraft httptcoletcvnwdz,"Media(photos=[], videos=[], animated=[])",0,0,0,-1.0,Negative
1543,1543,317171662363697152,26716318,themell,2013-03-28 07:09:51+00:00,wo die wilden Kerle wohnen,mach erst,"Media(photos=[], videos=[], animated=[])",1,0,0,0.0,Neutral
1544,1544,317167434916298753,142984550,FORMAT_at,2013-03-28 06:53:03+00:00,Österreich,erwartet sobald sturm bank erst begonn macht sinn mitzumach httptcohmsloemkt,"Media(photos=[], videos=[], animated=[])",0,0,0,0.0,Neutral
1545,1545,317164525252120576,531352351,pearldiver99,2013-03-28 06:41:30+00:00,Schweiz / Switzerland,muss wirklich report kamerateam zyp allfall dokumenti,"Media(photos=[], videos=[], animated=[])",0,0,0,1.0,Positive
1546,1546,317149084605636608,567953103,BWV_8,2013-03-28 05:40:08+00:00,,scheint wahrschein httptcowbyqylxq,"Media(photos=[], videos=[], animated=[])",0,0,0,0.0,Neutral
1547,1547,317049998246281218,89909386,JanRoessmann,2013-03-27 23:06:24+00:00,"Brüssel, Belgien",morg ganz demonstrativ abheb,"Media(photos=[], videos=[], animated=[])",0,0,0,0.0,Neutral
1548,1548,317037335361495041,124169534,vertig0nix,2013-03-27 22:16:05+00:00,"Terra, Sol System",morg mach regular macht,"Media(photos=[], videos=[], animated=[])",0,0,0,0.0,Neutral
1549,1549,317026412282392577,301717082,EchteDemokratie,2013-03-27 21:32:41+00:00,Deutschland,milliard euro contain eingetroff httptcoxirersdj,"Media(photos=[], videos=[], animated=[])",0,2,1,0.0,Neutral
1550,1550,317026338718498816,103594377,rheto,2013-03-27 21:32:23+00:00,In Deinem Kopf.,bargeld,"Media(photos=[], videos=[], animated=[])",0,0,0,0.0,Neutral
1551,1551,317021469299310593,52665485,strabaflix,2013-03-27 21:13:02+00:00,Berlin (Germany),neu brauch ost geld versteck bank,"Media(photos=[], videos=[], animated=[])",0,0,0,0.0,Neutral
1552,1552,317020363915661312,262630394,sauberhaui,2013-03-27 21:08:39+00:00,Hamburg,morg wenig bank bunt raushau eigenkapital gedeckt spass,"Media(photos=[], videos=[], animated=[])",0,0,0,0.35,Positive
1553,1553,316943752310714368,64675422,MrJohnNada,2013-03-27 16:04:13+00:00,Antartica ,lang schlangenberlin teil murr rausgeruckt,"Media(photos=[], videos=[], animated=[])",0,0,0,0.0,Neutral
1554,1554,316868445440442369,301717082,EchteDemokratie,2013-03-27 11:04:59+00:00,Deutschland,silvia hartmann kommentiert neu matratzenbank hahaha wisst passiert httptcoqqcdftwrp,"Media(photos=[], videos=[], animated=[])",0,1,0,0.0,Neutral
1555,1555,316836574497234944,1304013613,LoopingLouis8,2013-03-27 08:58:20+00:00,,geld illusion httptcocyxxkidxq,"Media(photos=[], videos=[], animated=[])",0,0,0,0.0,Neutral
1556,1556,316650368941584385,124169534,vertig0nix,2013-03-26 20:38:25+00:00,"Terra, Sol System",dienstag rechn donnerstag bestimmt vergess logik,"Media(photos=[], videos=[], animated=[])",0,0,0,0.0,Neutral
1557,1557,316616260777558016,130272303,xxCommander,2013-03-26 18:22:53+00:00,Hier und jetzt,morg bank geh geld abheb schaltermitarbeit freundlich daraufhinweis teil,"Media(photos=[], videos=[], animated=[])",0,1,0,1.0,Positive
1558,1558,316539228219662336,1304013613,LoopingLouis8,2013-03-26 13:16:47+00:00,,aktuell deutschland httptcouhqzof,"Media(photos=[], videos=[], animated=[])",0,0,0,0.0,Neutral
1559,1559,316453893057949696,124169534,vertig0nix,2013-03-26 07:37:42+00:00,"Terra, Sol System",offnung angst vorm begrund lacherlichod denkt jmdam donnerstag war panik verflog,"Media(photos=[], videos=[], animated=[])",0,0,0,0.0,Neutral
1560,1560,316450828485545984,479560158,frisch2at,2013-03-26 07:25:31+00:00,#DUbistMEHR,zypern bank bleib donnerstag httptcovzahdazdm,"Media(photos=[], videos=[], animated=[])",0,0,0,0.0,Neutral
1561,1561,316428193559089153,578874727,R_F_Bolanz,2013-03-26 05:55:34+00:00,"Bad Teinach-Zavelstein, Deutsc",zypriot bank bleib angst hol geld lach,"Media(photos=[], videos=[], animated=[])",0,0,0,0.0,Neutral
1562,1562,316318844631269376,286361635,MTaege,2013-03-25 22:41:04+00:00,Brandenburg,rezession getrieb jubeln bissl ideologi scheint regier erford kommt,"Media(photos=[], videos=[], animated=[])",0,0,0,1.0,Positive
1563,1563,316316134972477440,309011817,JoachimAigner,2013-03-25 22:30:18+00:00,"Ried, Oberösterreich",bank bleib lang geschloss httptcohzhksnwxas,"Media(photos=[], videos=[], animated=[])",0,0,0,0.0,Neutral
1564,1564,316271534090104833,14637033,mousseman,2013-03-25 19:33:04+00:00,Behind the baking soda,httptcohwkvpdtev genau grund notwend,"Media(photos=[], videos=[], animated=[])",0,0,0,0.0,Neutral
1565,1565,316271189456732161,14637033,mousseman,2013-03-25 19:31:42+00:00,Behind the baking soda,httptcohliscfmx hoffent staat,"Media(photos=[], videos=[], animated=[])",0,0,0,0.0,Neutral
1566,1566,316211072946286593,32839263,_No1,2013-03-25 15:32:49+00:00,US/CN/IL/D nomad,europaweit hegemonist deutsch regier verdient rettet geld leut,"Media(photos=[], videos=[], animated=[])",0,1,0,0.0,Neutral
1567,1567,316206955100254208,301717082,EchteDemokratie,2013-03-25 15:16:27+00:00,Deutschland,kanzlerin angela merkel sagt bayer httptcoxsrnbwtlx,"Media(photos=[], videos=[], animated=[])",0,0,0,0.0,Neutral
1568,1568,316161549804916736,14637033,mousseman,2013-03-25 12:16:02+00:00,Behind the baking soda,httptcowtchmznwbu geld bank sich eigent ganz einfach konsequenz,"Media(photos=[], videos=[], animated=[])",0,0,0,0.7,Positive
1569,1569,316154658412445696,301717082,EchteDemokratie,2013-03-25 11:48:39+00:00,Deutschland,geld abheb schwindel aufflieg lass meist wiss schon httptcovmqenixc,"Media(photos=[], videos=[], animated=[])",0,0,0,0.0,Neutral
1570,1570,316154420700266497,301717082,EchteDemokratie,2013-03-25 11:47:42+00:00,Deutschland,geld abheb schwindel aufflieg lass meist wiss schon httptcohqomilkbw,"Media(photos=[], videos=[], animated=[])",0,2,0,0.0,Neutral
1571,1571,316012842325266432,482793756,Trontir,2013-03-25 02:25:07+00:00,Made in West-Germany,zyp gerettet dienstag beginnt httptcojguxtt,"Media(photos=[], videos=[], animated=[])",0,0,0,0.0,Neutral
1572,1572,316005189586915328,15904103,socialhack,2013-03-25 01:54:42+00:00,Europe,macht klein spar,"Media(photos=[], videos=[], animated=[])",0,0,0,0.0,Neutral
1573,1573,315963205065265152,256910783,GabiElenaDohm,2013-03-24 23:07:53+00:00,,merkeldi darf fall prinzipi aufgeb,"Media(photos=[], videos=[], animated=[])",0,0,0,0.0,Neutral
1574,1574,315884922973855745,56580695,goodc0re,2013-03-24 17:56:49+00:00,🐰🕳️,gott imminent frau beim sagt minut geld sparkont mehr sich,"Media(photos=[], videos=[], animated=[])",0,0,0,0.0,Neutral
