,Unnamed: 0,TweetId,UserId,UserUsername,Date,Location,Tweet,Media,Likes,Retweets,Comments,Polarity,Sentiment
820,820,1494628916497195008,1446723219562680323,HansPeterGustaf,2022-02-18 11:04:37+00:00,,gibt rund million ungeimpft deutschland randgrupp vogel mein passiert bruchteil randgrupp macht blod wasch schau,"Media(photos=[], videos=[], animated=[])",18,7,2,0.0,Neutral
821,821,1494620570692030464,1354513047059103748,JustAnOpinion77,2022-02-18 10:31:27+00:00,,passiert zeigt ding wirklich bess physisch digital bargeld bleibt ineffizent bedeutet uneingeschrankt handlungsfrei nachteil,"Media(photos=[], videos=[], animated=[])",1,0,0,1.0,Positive
822,822,1494609604340293666,1434598382581002241,FranconiaMagic,2022-02-18 09:47:52+00:00,Franken,geht ganz schnell geld blockiert geht totalitar syst,"Media(photos=[], videos=[], animated=[])",5,1,1,0.7,Positive
823,823,1494316797880844289,17802669,JG_Nuke,2022-02-17 14:24:22+00:00,The North,looking bank that willing tell fudeau trucked refus comply that bank already,"Media(photos=[], videos=[], animated=[])",62,15,6,0.0,Neutral
824,824,1494607991965949957,3122174866,KChristian90,2022-02-18 09:41:28+00:00,,solidaritat kanadi,"Media(photos=[], videos=[], animated=[])",1,0,0,0.0,Neutral
825,825,1494607669533024263,3122174866,KChristian90,2022-02-18 09:40:11+00:00,,war solidar gegenub kanad truck find,"Media(photos=[], videos=[], animated=[])",1,0,0,0.0,Neutral
826,826,1494603079152508946,1472888774711554048,Daemmerungslfr,2022-02-18 09:21:57+00:00,"Kaiserslautern, Germany",meist deutsch befind wohlfuhlblas denk,"Media(photos=[], videos=[], animated=[])",2,0,0,0.0,Neutral
827,827,1494584771279736833,1445666469593767944,afool_only,2022-02-18 08:09:12+00:00,,komm egal supermarkt biolad fast imm umgeb gehorsam duckmaus angsthas einfach einkauf konnt arg geb leid wirklich,"Media(photos=[], videos=[], animated=[])",28,0,2,0.2333333333333333,Positive
828,828,1494560895422418959,885807546233217024,scarab51461082,2022-02-18 06:34:19+00:00,,kanada hol geld bank uberlebt syst,"Media(photos=[], videos=[], animated=[])",1,0,2,0.0,Neutral
829,829,1494558518640365589,1033758138330243073,pepemar79565814,2022-02-18 06:24:53+00:00,Planet Earth,ging schnell bargeldauszahl kanada weg teilweis gestoppt viel konteninhab wohl spat,"Media(photos=[], videos=[], animated=[])",7,3,1,0.35,Positive
830,830,1494471961199718403,1371217521089654786,stefan_eichardt,2022-02-18 00:40:56+00:00,29221 Celle,kind prot regier bring handlung geldstraf dollar jahr haft einbring,"Media(photos=[], videos=[], animated=[])",4,0,1,0.0,Neutral
831,831,1494470551657762821,1490826505424936961,einfachOtti,2022-02-18 00:35:20+00:00,,volk schau,"Media(photos=[], videos=[], animated=[])",0,0,0,0.0,Neutral
832,832,1494467963805700100,1371217521089654786,stefan_eichardt,2022-02-18 00:25:03+00:00,29221 Celle,immerhin abgeschafft bezahl moglich uberweis,"Media(photos=[], videos=[], animated=[])",2,0,0,0.0,Neutral
833,833,1494424052395618306,1434598382581002241,FranconiaMagic,2022-02-17 21:30:33+00:00,Franken,kananda interessiert artikel deutsch,"Media(photos=[], videos=[], animated=[])",1,0,0,1.0,Positive
836,836,1494258097744928769,560091333,Plebchartist,2022-02-17 10:31:07+00:00,,lot bank offlin yesterday evening canada,"Media(photos=[MediaPhoto(url='https://pbs.twimg.com/media/FLyr0czWYAYoZb6.jpg')], videos=[], animated=[])",4,0,1,0.0,Neutral
837,837,1494397549087707137,1445666469593767944,afool_only,2022-02-17 19:45:14+00:00,,bank existi geld uberlass bringt kohl sich holt genug solang konnt zerstor existenz zerstor,"Media(photos=[], videos=[], animated=[])",8,2,0,0.7,Positive
838,838,1494382388499169283,1477790970360082439,0xNick7x2,2022-02-17 18:45:00+00:00,,damn teil plan diabol,"Media(photos=[], videos=[], animated=[])",1,1,0,0.0,Neutral
840,840,1494357535918333958,157687175,SoulBrotha_1,2022-02-17 17:06:15+00:00,🌍🌎🌏,nachd trudeau einfrierenkonfiszi bankkont crowdfunding asset angedroht sof solidarisiert erst anzeich dafur bereit beobacht,"Media(photos=[], videos=[], animated=[])",0,0,0,0.0,Neutral
841,841,1494092820260532227,20675681,JamesMelville,2022-02-16 23:34:21+00:00,United Kingdom,what hell happening canadas bank right,"Media(photos=[MediaPhoto(url='https://pbs.twimg.com/media/FLwVf-jXEAADtys.jpg'), MediaPhoto(url='https://pbs.twimg.com/media/FLwVf-qXEAAdIrK.jpg'), MediaPhoto(url='https://pbs.twimg.com/media/FLwVf-rXoAEm5zh.jpg'), MediaPhoto(url='https://pbs.twimg.com/media/FLwVf-yXwAEKQ-U.jpg')], videos=[], animated=[])",31246,9034,2695,0.7,Positive
842,842,1494347488995782661,1323957551952744449,zoller_marco,2022-02-17 16:26:19+00:00,"Tirol,Kärnten, Österreich ",vielleicht braucht osterreich,"Media(photos=[], videos=[], animated=[])",5,2,0,0.0,Neutral
843,843,1494318909528281098,1300299222017867777,bloiner,2022-02-17 14:32:45+00:00,"Nö, Österreich",eigentum bald unmog,"Media(photos=[MediaPhoto(url='https://pbs.twimg.com/media/FLzjH9XVQAE_ZWM.jpg')], videos=[], animated=[])",46,13,9,0.0,Neutral
844,844,1494299614354329602,1304069947094687744,mr_marcus_fuchs,2022-02-17 13:16:05+00:00,"Sachsen, Deutschland",kanada meint bleibt lokal probl,"Media(photos=[], videos=[], animated=[])",12,3,3,0.0,Neutral
845,845,1494291643129909249,297301579,ChrisEbner_FM,2022-02-17 12:44:24+00:00,"Wien, Austria ",passiert form mittel langerfrist angelegt geordnet verlager form plotzlich,"Media(photos=[], videos=[], animated=[])",0,0,0,0.0,Neutral
846,846,1494273783481442312,297301579,ChrisEbner_FM,2022-02-17 11:33:26+00:00,"Wien, Austria ",regim wandelt imm mehr spur lost griff kont regimekrit,"Media(photos=[], videos=[], animated=[])",6,3,2,0.0,Neutral
848,848,1494267933597577218,913701139522228224,DegeBh,2022-02-17 11:10:12+00:00,"Pfarrkirchen i.R., Bayern, D",burg schuld diktator bugeln lass,"Media(photos=[], videos=[], animated=[])",1,0,0,0.0,Neutral
849,849,1494261070747389962,1446723219562680323,HansPeterGustaf,2022-02-17 10:42:55+00:00,,stet geld bank abheb solang komplett fall sogenannt farc hochst erweiter kafig bitt retweet mitmacht,"Media(photos=[], videos=[], animated=[])",33,13,5,0.0,Neutral
850,850,1494225752187076608,1446723219562680323,HansPeterGustaf,2022-02-17 08:22:35+00:00,,passiert eigent ungeimpft itali ungeimpft gleichzeit geld bank abheb spass,"Media(photos=[], videos=[], animated=[])",307,84,24,0.0,Neutral
851,851,1494224458600660992,354431847,Club12D,2022-02-17 08:17:26+00:00,* Sol System *,ankund kont finanzmitteln support sperr resultiert stark signal,"Media(photos=[], videos=[], animated=[])",0,0,0,0.7,Positive
852,852,1493862930454097923,748442137633652736,Seven4wakeup,2022-02-16 08:20:51+00:00,"Chur, Schweiz",sperrt demonstrant gefahr strategi demokrat sicht schnell end,"Media(photos=[], videos=[], animated=[])",31,9,2,0.7,Positive
853,853,1493694656508579848,1375093867557572610,RKhorinis,2022-02-15 21:12:12+00:00,Khorinis,warum bargeld wichtig,"Media(photos=[], videos=[MediaVideo(thumbnailUrl='https://pbs.twimg.com/ext_tw_video_thumb/1493694214869237768/pu/img/eYUWVTWWgJtuftdu.jpg', variants=[MediaVideoVariant(contentType='video/mp4', bitrate=2176000, url='https://video.twimg.com/ext_tw_video/1493694214869237768/pu/vid/1280x720/BLmTjff1u3NMB7zx.mp4?tag=12'), MediaVideoVariant(contentType='video/mp4', bitrate=256000, url='https://video.twimg.com/ext_tw_video/1493694214869237768/pu/vid/480x270/E8YQw6DeOhSKJZhp.mp4?tag=12'), MediaVideoVariant(contentType='video/mp4', bitrate=832000, url='https://video.twimg.com/ext_tw_video/1493694214869237768/pu/vid/640x360/-L0kv35tihvF0Ort.mp4?tag=12')], duration=53883, views=None)], animated=[])",58,19,10,0.7,Positive
854,854,1493685491627171846,814938618963836929,LunaUnruly,2022-02-15 20:35:47+00:00,,evtl erstmal klein auslos vermutl canada,"Media(photos=[], videos=[], animated=[])",9,2,0,0.0,Neutral
855,855,1493672375841443841,1488206565152808963,Harte_Wahrheit,2022-02-15 19:43:40+00:00,Überall und nirgends,losung problem liegt hand braucht geb viel spend furcht muss konto gesperrt jedoch ganz unappetit bild fuhr,"Media(photos=[], videos=[], animated=[])",4,1,0,-0.5,Negative
856,856,1480235980535828481,79137027,yucklo,2022-01-09 17:52:13+00:00,,wohl sag bekomm blackout crash finanzwes einzig vorteil zeitpunkt bestimm,"Media(photos=[], videos=[], animated=[])",0,0,1,0.0,Neutral
857,857,1467423866133921795,1445666469593767944,afool_only,2021-12-05 09:21:27+00:00,,vielleicht beginnt genau,"Media(photos=[], videos=[], animated=[])",1,0,0,0.0,Neutral
858,858,1465471227833860105,79137027,yucklo,2021-11-30 00:02:22+00:00,,geilo bericht gerad scheinbar studienabbrech bescheuert erklar morg erst kohl bank hol bevor automat leer,"Media(photos=[], videos=[], animated=[])",1,0,0,-1.0,Negative
859,859,1460620957580775430,206207360,Syggiy,2021-11-16 14:49:07+00:00,Europa,rational eher arbeit end zahlt eigent finanzindustri angst stimmt,"Media(photos=[], videos=[], animated=[])",0,0,0,1.0,Positive
860,860,1458599524390387714,34107577,BarryDutton,2021-11-11 00:56:40+00:00,#Canadastan | #TaxationIsTheft,frenz,"Media(photos=[MediaPhoto(url='https://pbs.twimg.com/media/FD38hgRXwAI8IHS.jpg')], videos=[], animated=[])",2,0,0,0.0,Neutral
861,861,1457429405198954505,206207360,Syggiy,2021-11-07 19:27:02+00:00,Europa,geht thema anfang verschleierungstakt verwendet geht imho abmilder infolg end,"Media(photos=[], videos=[], animated=[])",1,0,0,0.0,Neutral
862,862,1456666068135591937,206207360,Syggiy,2021-11-05 16:53:48+00:00,Europa,strategi ziel jedoch geht geht darum bewahr hierzu voll notwend ergo verbiet etabli,"Media(photos=[], videos=[], animated=[])",0,0,0,0.0,Neutral
863,863,1454084888051781640,482793756,Trontir,2021-10-29 13:57:07+00:00,Made in West-Germany,schon mehrkornbrotch nein passiert inflation geschurt staatsschuld entwert konnt burgerinn ansetz anlag umrubeln,"Media(photos=[], videos=[], animated=[])",0,0,0,0.0,Neutral
864,864,1453635463521177600,206207360,Syggiy,2021-10-28 08:11:16+00:00,Europa,erwart war mensch angeb notwend massnahm abgelenkt erzog insbesond,"Media(photos=[], videos=[], animated=[])",0,0,0,0.0,Neutral
865,865,1445045436373508100,1373276675157471234,LOracle1111,2021-10-04 15:17:34+00:00,"Austria, Europe",tipp bank vertrau hebt geld bevor negativzins enteign kommt,"Media(photos=[], videos=[], animated=[])",0,0,0,0.0,Neutral
866,866,1444642706869964802,973807661530648582,cArtIntel,2021-10-03 12:37:16+00:00,Frankfurt,dispo nach woch montag dienstag mittwoch panamapap releas donnerstag credit suiss dataleak freitag end spiel,"Media(photos=[], videos=[], animated=[])",0,0,0,0.0,Neutral
867,867,1443571677309272070,206207360,Syggiy,2021-09-30 13:41:22+00:00,Europa,seit kurz beginn end mehr verdoppelt word end irgendetwas gescheh geldmeng reduzi inflation losung fall gibt,"Media(photos=[], videos=[], animated=[])",0,0,0,0.0,Neutral
868,868,1442845712719532035,206207360,Syggiy,2021-09-28 13:36:39+00:00,Europa,frag end zinsspann fluchtet bevorsteh repressali einub ausnahmezustand,"Media(photos=[], videos=[], animated=[])",1,0,0,0.0,Neutral
869,869,1438399971162836992,206207360,Syggiy,2021-09-16 07:10:51+00:00,Europa,geh sogar schritt befurcht eigent hintergrund inzwisch end steht umbruch bevor unruh keim erstick seit geubt,"Media(photos=[], videos=[], animated=[])",0,0,0,0.0,Neutral
870,870,1425547895571365891,79137027,yucklo,2021-08-11 20:01:18+00:00,,gibt zwei ding syst sofort kollabi lass deutsch geht morg bank hebt euros zumind recht gross betrag sofort zuend,"Media(photos=[], videos=[], animated=[])",0,0,0,0.7,Positive
871,871,1384790142322413569,1105950362186539010,0xPectations_,2021-04-21 08:44:32+00:00,Solar System,fall mitbekomm ganz nebenbei direktiv letzt woch umsetz gest debit kreditkart taglich gesenkt angst,"Media(photos=[], videos=[], animated=[])",5,1,2,0.0,Neutral
872,872,1359165520319295492,206207360,Syggiy,2021-02-09 15:41:26+00:00,Europa,geht lang mindest unternehm angemeldet durft probl geb vielleicht erlebt endlich gewunscht ziel,"Media(photos=[], videos=[], animated=[])",1,0,1,0.0,Neutral
873,873,1354941558836113412,1349469355243929609,lamagesara,2021-01-28 23:56:55+00:00,"Hesse, Germany",silberpreis hinbekomm passi fall ganz sach,"Media(photos=[], videos=[], animated=[])",2,0,0,0.0,Neutral
874,874,1346088850737819649,62788233,gernfried2000,2021-01-04 13:39:25+00:00,am schönen Niederrhein,schon heut spazi gegang warteschlang,"Media(photos=[], videos=[], animated=[])",0,0,0,0.0,Neutral
875,875,1341786876265558018,713679936486260736,camper_ps,2020-12-23 16:44:55+00:00,,vermut ganz show dient mental vorbereit mensch geplant macht einfach,"Media(photos=[], videos=[], animated=[])",0,0,0,0.7,Positive
876,876,1341755886444945409,1257898714917715969,SHomburg,2020-12-23 14:41:46+00:00,"Hannover, Germany",weihnachtsgeschenk lieb twitt feiertag faktenf find link kompakt information aktuell coronalag destatis euromomo divi wunsch froh fest,"Media(photos=[MediaPhoto(url='https://pbs.twimg.com/media/Ep7ehRyWwAE3JzX.jpg')], videos=[], animated=[])",1059,208,190,-0.1333333333333333,Negative
877,877,1338795872323252227,755315046905946116,Genossin_Anetta,2020-12-15 10:39:44+00:00,Hohenschönhausen,gibt einzig echt erfolg zusamm regier moglicherweis kollaps finanzsyst verhindert leid beschwort wahnwitz coronapolit erneut gefahr syst kollabiert,"Media(photos=[], videos=[], animated=[])",2,0,0,0.0,Neutral
878,878,1319723250700685313,1013709266958667777,joergjessen,2020-10-23 19:31:56+00:00,"Hamburg, Germany",plan laut interview macht sinn vorab zuwid lauf einfuhr digital euro zud besteht unterschied einfuhr bundesbankkonto wallet girokonto verfug bargeld,"Media(photos=[], videos=[], animated=[])",1,0,1,0.0,Neutral
879,879,1319165757465518085,149980296,TomDapp,2020-10-22 06:36:40+00:00,"Frankfurt on the Main, Germany",sieht erhoht risiko konkret diskussion stattfind dadurch entsteht transparenz dringend zustand autoritat brauch breit diskur,"Media(photos=[], videos=[], animated=[])",1,0,0,0.0,Neutral
880,880,1318505750969409537,481896815,SoftwareKater,2020-10-20 10:54:02+00:00,wo das Herz noch zählt,gilt gleich panik panik first best strategi fuhrt leid leer supermarktregal leer bankautomat borsencrash ungunst muss polit massnahm,"Media(photos=[], videos=[], animated=[])",0,0,1,0.0,Neutral
881,881,1308321259864940544,16295931,Moorbek,2020-09-22 08:24:30+00:00,Land der Leguane,deutsch erhoh sich sag auf onlinekonto zuzugreif denk tan schon beim anmeld eher zweck fall onlinezugang kommod stillzuleg,"Media(photos=[], videos=[], animated=[])",0,0,0,0.7,Positive
882,882,1296789650053496833,82828746,gtorges,2020-08-21 12:42:00+00:00,Planet Punk,offenbar begonn leut heb geld versuch devis umzutausch erst begrenz abheb,"Media(photos=[], videos=[], animated=[])",1,0,0,0.0,Neutral
883,883,1296735496312324098,81572408,franakviacorka,2020-08-21 09:06:49+00:00,"Minsk, Belarus",aft crackdown beginning strik peopl withdraw their deposit from belarus bank sell belarus rubl rubl reaching low again dollar euro telegram peopl call boycott stat compani from privat firm,"Media(photos=[], videos=[], animated=[])",433,188,10,0.0,Neutral
884,884,1284846113959419909,119132338,LewHol,2020-07-19 13:42:39+00:00,#CorruptionLand 🇨🇭,weiss mehr,"Media(photos=[], videos=[], animated=[])",0,1,0,0.0,Neutral
885,885,1280774987251683329,883057587217944576,CoinCapXT,2020-07-08 08:05:27+00:00,,kommt bald georg soros trennt meist finanzakti,"Media(photos=[MediaPhoto(url='https://pbs.twimg.com/media/EcY5k2bWAAAiEcY.jpg')], videos=[], animated=[])",0,0,0,0.0,Neutral
886,886,1279499418476126208,350156375,resaccessoria,2020-07-04 19:36:47+00:00,Berlin,hatt tank gemusst amazon onlin centgenau guthab kreditkart kauf,"Media(photos=[], videos=[], animated=[])",0,0,1,0.0,Neutral
887,887,1276742585835565056,561907307,eTomekk,2020-06-27 05:02:07+00:00,Krautz,donnerstag abend tank gutschein geholt neun konto leer freitag abend meldung voruberg konto gesperrt,"Media(photos=[MediaPhoto(url='https://pbs.twimg.com/media/EbfmnXFXYAAv1GF.jpg')], videos=[], animated=[])",1,0,1,-1.0,Negative
888,888,1261013455420698626,3580389317,CHelwegen,2020-05-14 19:20:10+00:00,Emilia Romagna ,tsja bank,"Media(photos=[], videos=[], animated=[])",0,0,0,0.0,Neutral
889,889,1260834808680366080,883057587217944576,CoinCapXT,2020-05-14 07:30:18+00:00,,realitat kommt langsam this,"Media(photos=[MediaPhoto(url='https://pbs.twimg.com/media/EX9iXB_WsAENLNW.png')], videos=[], animated=[])",1,0,0,-0.7,Negative
890,890,1256986361426518017,3086012806,TV_Reporter,2020-05-03 16:37:56+00:00,✝️✝️✝️,roland deutsch spar gastbeitrag offenbar empfohl mog sparkonto hol,"Media(photos=[MediaPhoto(url='https://pbs.twimg.com/media/EXG1rYuXYAM4jn_.jpg')], videos=[], animated=[])",2,0,0,0.0,Neutral
891,891,1247555105886519298,1195804029466677251,PeterKr51732536,2020-04-07 16:01:30+00:00,Deutschland,uiuiui meldung filt rosarot brill schwach,"Media(photos=[], videos=[], animated=[])",0,1,0,-0.7,Negative
892,892,1245453086522576900,1233864700271697920,EKommandante,2020-04-01 20:48:49+00:00,,fallt leid welcom ebay preis schnapps schon erhoht,"Media(photos=[], videos=[], animated=[])",0,0,0,0.0,Neutral
893,893,1244178172255645703,1233864700271697920,EKommandante,2020-03-29 08:22:46+00:00,,morg geh frohlich sowi heb maximal bargeld incomming,"Media(photos=[], videos=[], animated=[])",0,0,0,0.7,Positive
894,894,1243480011937656832,927624634190745605,SaschaGenders,2020-03-27 10:08:32+00:00,"Würzburg, Deutschland",sinn enorm nachfrag programm zeigt massnahm rechtfert,"Media(photos=[], videos=[], animated=[])",0,0,0,0.0,Neutral
895,895,1243409635886825472,1014586521402396674,LogTech_Verband,2020-03-27 05:28:53+00:00,"Stahnsdorf, Deutschland",find fehl bank problemat handel probl antwort kris belachelt wurd umzusetz,"Media(photos=[], videos=[], animated=[])",2,0,1,0.0,Neutral
896,896,1242858122567434240,1242854231100489735,outbrea51914082,2020-03-25 16:57:22+00:00,,wohl jemand schiss,"Media(photos=[], videos=[], animated=[])",0,0,0,0.0,Neutral
897,897,1242569125089681408,98896448,BushMasterSix,2020-03-24 21:48:59+00:00,Cayman-Inseln,wort,"Media(photos=[], videos=[], animated=[])",0,0,0,0.0,Neutral
898,898,1242063042747207680,64675422,MrJohnNada,2020-03-23 12:18:00+00:00,Antartica ,ernstgemeint frag weiss jemand berlin gold silbermunz ersteh proaurum degussa reisebank,"Media(photos=[], videos=[], animated=[])",0,0,0,0.0,Neutral
899,899,1241979444966948864,1233864700271697920,EKommandante,2020-03-23 06:45:49+00:00,,ausverkauft handl tausch mehr wertlos incoming,"Media(photos=[], videos=[], animated=[])",0,0,0,-0.7,Negative
900,900,1241978870347247621,1233864700271697920,EKommandante,2020-03-23 06:43:32+00:00,,nah automat leer mehr staat verschweigt bald wertlos,"Media(photos=[], videos=[], animated=[])",0,0,0,-0.175,Negative
901,901,1241978386504921088,1233864700271697920,EKommandante,2020-03-23 06:41:36+00:00,,gestorb nationalstaat uberleb brok your money,"Media(photos=[], videos=[], animated=[])",0,0,0,0.0,Neutral
902,902,1241883516390068236,1122622619134701568,CriticalMr,2020-03-23 00:24:38+00:00,,versucht verhind,"Media(photos=[], videos=[], animated=[])",0,0,0,0.0,Neutral
903,903,1241310314244853763,585056504,ThommyMannheim,2020-03-21 10:26:56+00:00,Mannheim 🇩🇪,weh leut ide komm bargeld hamst ahnlich unerwartet komm herdentriebgesteuert ahnlich kollektiv gleich ltnachtigall trapsengt,"Media(photos=[], videos=[], animated=[])",1,0,0,-1.0,Negative
904,904,1241112371092951046,222902933,OllenBurk,2020-03-20 21:20:22+00:00,,wusst marod geschaftsbank global geldsyst ausgangssperr verhang verkund,"Media(photos=[], videos=[], animated=[])",1,0,0,0.0,Neutral
905,905,1241096345307537408,17709932,informelles,2020-03-20 20:16:41+00:00,Germany,kris schwachsinn aktion imm mehr anheiz,"Media(photos=[], videos=[], animated=[])",0,1,0,0.0,Neutral
906,906,1240943751348060165,124258206,KowalczeKamil,2020-03-20 10:10:20+00:00,"Berlin, Germany",lebensmittelhandel ruckblick ereignis freitag umgeh,"Media(photos=[], videos=[], animated=[])",1,1,0,0.0,Neutral
907,907,1240339890879041546,3108963125,LennLennDE,2020-03-18 18:10:49+00:00,"Knippland, Deutschland",beginnt imm mehr kund heb gross meng bargeld bescheuert,"Media(photos=[], videos=[], animated=[])",0,0,1,-0.10000000000000002,Negative
908,908,1239995466747654144,906178356466634752,WalterKnallter,2020-03-17 19:22:11+00:00,,heutig versicher bedurf halbwertszeit madch,"Media(photos=[MediaPhoto(url='https://pbs.twimg.com/media/ETVZTI8WAAEzXef.jpg')], videos=[], animated=[])",0,1,1,0.0,Neutral
909,909,1239554280668958720,1237814792506806275,Quann82316175,2020-03-16 14:09:04+00:00,,egal seht heut konnt wart mehr geld bekommt findet borsencrash statt scheint antwort darauf geb,"Media(photos=[], videos=[], animated=[])",1,0,1,0.0,Neutral
910,910,1239458332039163906,1078327617860894720,chaincheck_de,2020-03-16 07:47:49+00:00,Germany,halt sowi bankkonto wieviel bereit verli,"Media(photos=[], videos=[], animated=[])",0,0,0,0.0,Neutral
911,911,1239283160820695043,1233864700271697920,EKommandante,2020-03-15 20:11:44+00:00,,morg freigenomm schon bevor hiezwert tausch produkt,"Media(photos=[], videos=[], animated=[])",2,0,0,0.7,Positive
912,912,1239281662074048512,1233864700271697920,EKommandante,2020-03-15 20:05:47+00:00,,anhalt verhind bevor gehalt kommt eingefuhrt rettet vorh geld,"Media(photos=[], videos=[], animated=[])",0,0,1,0.0,Neutral
913,913,1239280754682707970,1233864700271697920,EKommandante,2020-03-15 20:02:11+00:00,,mach lib darub gedank passiert notruf mehr angenomm schweig medi,"Media(photos=[], videos=[], animated=[])",0,0,0,0.0,Neutral
914,914,1239107913840578561,459366859,bender2312,2020-03-15 08:35:22+00:00,Stuttgart,klar warum kris geldanlag reagiert eben verstand kommt bitcoin phonix asch steig,"Media(photos=[], videos=[], animated=[])",2,0,0,1.0,Positive
915,915,1238939674070179849,15271509,fatmike182,2020-03-14 21:26:51+00:00,"Vienna, Austria",kann wiederhol anonym troll offent sozial medi gefahr uninformiert besserwisser geruchteverbreiter_inn nah umfeld,"Media(photos=[], videos=[], animated=[])",8,1,0,0.85,Positive
916,916,1238139667029135360,15271509,fatmike182,2020-03-12 16:27:54+00:00,"Vienna, Austria",erstmal fallt vergleich whatsappchatgrupp social media wirklich gerucht schon seit tag whatsapp gestreut gestutzt quell verhandlungskreis echt normal schnell infos panik verbreit,"Media(photos=[], videos=[], animated=[])",3,0,1,0.2333333333333333,Positive
917,917,1238838166628577281,459366859,bender2312,2020-03-14 14:43:30+00:00,Stuttgart,lockdown kommt erst viel mensch geld regier bank uberrascht feststell mensch einzig gesetz zahlungsmittel verhindert folg shutdown,"Media(photos=[], videos=[], animated=[])",2,0,0,-0.5,Negative
918,918,1238800569478848512,92983416,Murgpirat,2020-03-14 12:14:06+00:00,,ganz wundert stattgefund mensch vergess wohl beim bank betroff geldautomat aufgefullt,"Media(photos=[], videos=[], animated=[])",3,0,3,0.0,Neutral
919,919,1238755680791736320,222902933,OllenBurk,2020-03-14 09:15:43+00:00,,mensch seh toilettenpapi neig geh mehr allzu weit davon entfernt realisi bargeld neig geh selbsterfull prophezeih fuhrt kettenreaktion,"Media(photos=[], videos=[], animated=[])",0,0,0,0.0,Neutral
920,920,1238437241707528193,459366859,bender2312,2020-03-13 12:10:22+00:00,Stuttgart,lass leut erspart eventuell gefullt girokonto,"Media(photos=[], videos=[], animated=[])",0,0,0,0.0,Neutral
921,921,1238435992635310082,459366859,bender2312,2020-03-13 12:05:24+00:00,Stuttgart,passiert eigent spar kont guthabenihr geld abheb haus richtig hos geh,"Media(photos=[], videos=[], animated=[])",0,0,1,1.0,Positive
922,922,1238278207067078659,2515037496,mariawebermann,2020-03-13 01:38:25+00:00,"Krefeld, Deutschland",heut freitag steht breitet bald spat lauft bank gebt geld maus rett sagt depp,"Media(photos=[], videos=[], animated=[])",2,0,0,0.0,Neutral
923,923,1238020277633798146,2515037496,mariawebermann,2020-03-12 08:33:30+00:00,"Krefeld, Deutschland",heut morg erst seit punkt gefall,"Media(photos=[MediaPhoto(url='https://pbs.twimg.com/media/ES5UmXgWkAAQhUn.png')], videos=[], animated=[])",0,0,0,0.0,Neutral
924,924,1237897963822702594,806564242145083394,Barbarella9876,2020-03-12 00:27:28+00:00,,bankenkatastroph scheint land niemand interessi schuh schieb ganz bitt erwach geb,"Media(photos=[], videos=[], animated=[])",0,0,0,0.0,Neutral
925,925,1237662041474830336,2995283307,Unbasiert,2020-03-11 08:49:59+00:00,,auslos habt gedank gemacht passiert bank nach zeit pleit geht vorrat bevor ide kam,"Media(photos=[], videos=[], animated=[])",4,0,2,0.0,Neutral
926,926,1237133283739275265,397126521,AstrProgressive,2020-03-09 21:48:54+00:00,Trapani ,alternativ international aktiendepot geld unt kopfkiss selbstversorgerinitiativeteilhab waff bitt vorschlag,"Media(photos=[], videos=[], animated=[])",0,0,0,0.0,Neutral
927,927,1235511286810566656,222902933,OllenBurk,2020-03-05 10:23:40+00:00,,geldsyst steht kurz kollaps leitzinssenk bekampf fuhr nimmt burg moglich vermog sich beitrag verfolgt polit agenda,"Media(photos=[], videos=[], animated=[])",2,0,0,-1.0,Negative
928,928,1230850233036308481,2232463302,FarSight3,2020-02-21 13:42:18+00:00,,beginnt,"Media(photos=[], videos=[], animated=[])",1,0,0,0.0,Neutral
929,929,1230776826726879232,243318995,runews,2020-02-21 08:50:36+00:00,,report defaulted bank china begin,"Media(photos=[], videos=[MediaVideo(thumbnailUrl='https://pbs.twimg.com/ext_tw_video_thumb/1230776808196464640/pu/img/8lYNxacGNPI55N9R.jpg', variants=[MediaVideoVariant(contentType='video/mp4', bitrate=632000, url='https://video.twimg.com/ext_tw_video/1230776808196464640/pu/vid/304x640/f-P6-Di30khwWJMw.mp4?tag=10')], duration=15000, views=None)], animated=[])",4575,2318,262,0.0,Neutral
930,930,1217182489141293056,1214989636805824513,duchschnittsdu1,2020-01-14 20:31:34+00:00,,halb rostock ganz frisch luft vorm geldautomat verbringt wohl letzt arbeitstag monat,"Media(photos=[], videos=[], animated=[])",4,0,0,0.0,Neutral
